### ISSUE TITLE
"Curl_http_done" on curl which watches for URL

### ISSUE THREAD

**Issue by kayrus** [curl/curl#1068]
### I did this

```sh
curl -vs https://10.254.0.1:443/api/v1/watch/events?resourceVersion=1897550
```

after ~15-20 minutes I get

```
* Curl_http_done: called premature == 0
* Connection #0 to host 10.254.0.1 left intact
```

### I expected the following

curl should not close the connection

### curl/libcurl version

```
curl 7.50.3 (x86_64-alpine-linux-musl) libcurl/7.50.3 OpenSSL/1.0.2i zlib/1.2.8 libssh2/1.7.0
Protocols: dict file ftp ftps gopher http https imap imaps pop3 pop3s rtsp scp sftp smb smbs smtp smtps telnet tftp 
Features: IPv6 Largefile NTLM NTLM_WB SSL libz TLS-SRP UnixSockets
```

### operating system

Alpine Linux 3.4 inside the Docker

### tcpdump

```
14:45:15.082323 IP kubernetes-events-printer-99661249-279zw.36030 > kubernetes.default.svc.cluster.local.443: Flags [.], ack 3842, win 1228, options [nop,nop,TS val 1145117422 ecr 1274098641], length 0
14:45:16.175525 IP kubernetes-events-printer-99661249-279zw.36030 > kubernetes.default.svc.cluster.local.443: Flags [.], ack 3842, win 1228, options [nop,nop,TS val 1145117696 ecr 1274098641], length 0
14:45:16.175743 IP kubernetes.default.svc.cluster.local.443 > kubernetes-events-printer-99661249-279zw.36030: Flags [.], ack 1, win 259, options [nop,nop,TS val 1274113681 ecr 1145117422], length 0
14:46:16.335552 IP kubernetes-events-printer-99661249-279zw.36030 > kubernetes.default.svc.cluster.local.443: Flags [.], ack 3842, win 1228, options [nop,nop,TS val 1145132736 ecr 1274113681], length 0
14:46:16.335836 IP kubernetes.default.svc.cluster.local.443 > kubernetes-events-printer-99661249-279zw.36030: Flags [.], ack 1, win 259, options [nop,nop,TS val 1274128721 ecr 1145117422], length 0
14:46:20.232580 IP kubernetes.default.svc.cluster.local.443 > kubernetes-events-printer-99661249-279zw.36030: Flags [P.], seq 3842:3876, ack 1, win 259, options [nop,nop,TS val 1274129695 ecr 1145117422], length 34
14:46:20.232641 IP kubernetes-events-printer-99661249-279zw.36030 > kubernetes.default.svc.cluster.local.443: Flags [.], ack 3876, win 1228, options [nop,nop,TS val 1145133710 ecr 1274129695], length 0
14:46:20.232786 IP kubernetes-events-printer-99661249-279zw.36030 > kubernetes.default.svc.cluster.local.443: Flags [P.], seq 1:32, ack 3876, win 1228, options [nop,nop,TS val 1145133710 ecr 1274129695], length 31
14:46:20.232891 IP kubernetes-events-printer-99661249-279zw.36030 > kubernetes.default.svc.cluster.local.443: Flags [F.], seq 32, ack 3876, win 1228, options [nop,nop,TS val 1145133710 ecr 1274129695], length 0
14:46:20.233012 IP kubernetes.default.svc.cluster.local.443 > kubernetes-events-printer-99661249-279zw.36030: Flags [P.], seq 3876:3907, ack 33, win 259, options [nop,nop,TS val 1274129695 ecr 1145133710], length 31
14:46:20.233055 IP kubernetes-events-printer-99661249-279zw.36030 > kubernetes.default.svc.cluster.local.443: Flags [R], seq 432558322, win 0, length 0
14:46:20.233106 IP kubernetes.default.svc.cluster.local.443 > kubernetes-events-printer-99661249-279zw.36030: Flags [F.], seq 3907, ack 33, win 259, options [nop,nop,TS val 1274129695 ecr 1145133710], length 0
14:46:20.233151 IP kubernetes-events-printer-99661249-279zw.36030 > kubernetes.default.svc.cluster.local.443: Flags [R], seq 432558322, win 0, length 0
```

**Comment by bagder** [comment]
That looks just like the transfer ended at that point. Like perhaps the end chunk in a chunked encoded stream was received (the fact that it leaves  the connection alive also indicates that curl saw it as a clean stop). We need to reproduce this to understand it, or you need to provide us with more protocol details of what went over the wire the second immediately before it stopped the transfer.

**Comment by kayrus** [comment]
Ok, i'll create full tcpdump.

**Comment by kayrus** [comment]
At first glance it looks like a `kube-proxy` behavior which updates `iptables` rules and connection is being interrupted.

**Comment by bagder** [comment]
Seems like a problem caused by something else then.
