### ISSUE TITLE
"curl --http2-prior-knowledge -X CONNECT ..." generates incorrect set of headers for the CONNECT request

### ISSUE THREAD

**Issue by maxgeorg** [curl/curl#1575]
### I did this

curl -v --http2-prior-knowledge -X CONNECT -x [2803:6082:1140:2447::1]:8081 http://www.google.com

I used tcpdump to capture the packets exchanged, and used WireShark to decode the header block for the CONNECT request:

> Frame 6: 175 bytes on wire (1400 bits), 175 bytes captured (1400 bits)
> Ethernet II, Src: Mellanox_51:d7:22 (00:02:c9:51:d7:22), Dst: Cisco_54:6e:7c (54:7f:ee:54:6e:7c)
> Internet Protocol Version 6, Src: 2401:db00:11:d010:face::1d:0, Dst: 2803:6082:1140:2447::1
> Transmission Control Protocol, Src Port: 36618, Dst Port: 8081, Seq: 34, Ack: 1, Len: 89
> HyperText Transfer Protocol 2
>     Stream: HEADERS, Stream ID: 1, Length 80
>         Length: 80
>         Type: HEADERS (1)
>         Flags: 0x05
>         0... .... .... .... .... .... .... .... = Reserved: 0x0
>         .000 0000 0000 0000 0000 0000 0000 0001 = Stream Identifier: 1
>         [Pad Length: 0]
>         Header Block Fragment: 4207434f4e4e45435404919d29aee30c78f1e1798e79a82a...
>         [Header Length: 188]
>         [Header Count: 7]
>         Header: :method: CONNECT
>         Header: :path: http://www.google.com/
>         Header: :scheme: http
>         Header: :authority: www.google.com
>         Header: user-agent: curl/7.51.0
>         Header: accept: */*
>         Header: proxy-connection: Keep-Alive
>         Padding: <MISSING>

### I expected the following

According to [RFC 7540](https://tools.ietf.org/html/rfc7540#section-8.3) header block for HTTP2 connect request must not contain ":path:" and ":scheme:" headers:

> In HTTP/2, the CONNECT method is used to establish a tunnel over a
>    single HTTP/2 stream to a remote host for similar purposes.  The HTTP
>    header field mapping works as defined in Section 8.1.2.3 ("Request
>    Pseudo-Header Fields"), with a few differences.  Specifically:
> 
>    o  The ":method" pseudo-header field is set to "CONNECT".
> 
>    o  The ":scheme" and ":path" pseudo-header fields MUST be omitted.

### curl/libcurl version

curl 7.51.0 (x86_64-redhat-linux-gnu) libcurl/7.51.0 NSS/3.21 Basic ECC zlib/1.2.7 libidn2/2.0.2 libpsl/0.7.0 (+libicu/50.1.2) libssh2/1.4.3 nghttp2/1.21.1

### operating system

CentOS Linux 7 (Core)

**Comment by bagder** [comment]
curl speaks HTTP 1.1 with proxies

`--http2-prior-knowledge` is for the server connection and Google's servers do not speak that without negotiation

You've using a clear-text HTTP:// URL and google certainly doesn't support HTTP/2 without HTTPS...

**Comment by maxgeorg** [comment]
@bagder, thank you for your response!

With that curl command I was trying to test if my local proxy understands clear-text  no-upgrade HTTP2 CONNECT. Google server capabilities are not important in this scenario, since it'd be between the proxy and Google server to decide which protocol to use. I don't even get to the stage where proxy connects to a server. Proxy rejects curl's CONNECT request because of the reason I describe above.

All I'm saying is that CONNECT command is special in HTTP2 since according to the RFC it's illegal to include ":scheme" and ":path" headers into CONNECT request. Curl does not respect that.

**Comment by bagder** [comment]
`-X` doesn't modify how curl behaves, it only changes the method string. Thus you will get GET behavior with this command line, but using the `CONNECT` method. You asked for it.

If you rather want `CONNECT` though the proxy to a non-HTTPS URL, you should use `-p` or `--proxytunnel`. Although that will use HTTP/1.1 to the proxy. I can't think of a way to make curl do h2 prior knowledge to the proxy, and I'm quite sure it doesn't support tunneling through a h2 proxy.

**Comment by bagder** [comment]
As this issue hasn't gotten any further traction for three weeks and is mostly "you asked for it", this case is considered closed.
