### ISSUE TITLE
time_pretransfer reported wrong timestamp

### ISSUE THREAD

**Issue by JazJas** [curl/curl#11676]
### I did this

Curl man page says:

time_pretransfer:  The  time, in seconds, it took from the start until the file transfer was just about to begin. This includes all pre-transfer commands and negotiations that are specific to the particular protocol(s) involved.

However, curl (all versions) actually set the time_pretransfer incorrectly. 

I used curl to send a large text file (134M) as a payload of a POST request to a HTTP server using the following syntax:
curl -s -w "%{time_pretransfer}\n%{time_starttransfer}\n" -o /dev/null --data-binary @file.txt --header @$headers_file $server_url --insecure

At the same time,  tcpdump was used to capture all network packets.

When the curl command finished, I got:

time_pretransfer: 0.017484
time_starttransfer: 1.018670 

However, when analyzing the captured packets, Time 0.017484 is roughly the point when the client sent the first packet of the request (ie Packet 4). 
In fact, the entire POST request is sent over the wire completely at Time 1.156250 (ie Packet 175).

~~~
    1   0.000000 192.168.46.132 → 192.168.70.34 TCP 80 59664 → 80 [SYN] Seq=0 Win=64240 Len=0 MSS=1460 SACK_PERM TSval=3381780598 TSecr=0 WS=128
    2   0.017261 192.168.70.34 → 192.168.46.132 TCP 66 80 → 59664 [SYN, ACK] Seq=0 Ack=1 Win=64240 Len=0 MSS=1460
    3   0.017298 192.168.46.132 → 192.168.70.34 TCP 60 59664 → 80 [ACK] Seq=1 Ack=1 Win=64240 Len=0
    4   0.017377 192.168.46.132 → 192.168.70.34 TCP 848 POST / HTTP/1.1  [TCP segment of a reassembled PDU]
    5   0.017506 192.168.70.34 → 192.168.46.132 TCP 66 80 → 59664 [ACK] Seq=1 Ack=789 Win=64240 Len=0
    6   1.018656 192.168.46.132 → 192.168.70.34 HTTP 7360 POST / HTTP/1.1  (application/x-www-form-urlencoded)Continuation
    7   1.018717 192.168.46.132 → 192.168.70.34 HTTP 7360 Continuation
    8   1.018914 192.168.70.34 → 192.168.46.132 TCP 66 80 → 59664 [ACK] Seq=1 Ack=2249 Win=64240 Len=0
    9   1.018914 192.168.70.34 → 192.168.46.132 TCP 66 80 → 59664 [ACK] Seq=1 Ack=3709 Win=64240 Len=0
   10   1.018914 192.168.70.34 → 192.168.46.132 TCP 66 80 → 59664 [ACK] Seq=1 Ack=5169 Win=64240 Len=0
   11   1.018915 192.168.70.34 → 192.168.46.132 TCP 66 80 → 59664 [ACK] Seq=1 Ack=6629 Win=64240 Len=0
   12   1.018915 192.168.70.34 → 192.168.46.132 TCP 66 80 → 59664 [ACK] Seq=1 Ack=8089 Win=64240 Len=0
   13   1.018915 192.168.70.34 → 192.168.46.132 TCP 66 80 → 59664 [ACK] Seq=1 Ack=9549 Win=64240 Len=0
   14   1.018934 192.168.46.132 → 192.168.70.34 HTTP 2980 Continuation
   15   1.018978 192.168.46.132 → 192.168.70.34 HTTP 2980 Continuation
   16   1.019120 192.168.70.34 → 192.168.46.132 TCP 66 80 → 59664 [ACK] Seq=1 Ack=11009 Win=64240 Len=0
   17   1.019121 192.168.70.34 → 192.168.46.132 TCP 66 80 → 59664 [ACK] Seq=1 Ack=12469 Win=64240 Len=0

  173   1.096653 192.168.70.34 → 192.168.46.132 TCP 66 [TCP ZeroWindow] 80 → 59664 [ACK] Seq=1 Ack=193509 Win=0 Len=0
  174   1.156231 192.168.70.34 → 192.168.46.132 TCP 66 [TCP Window Update] 80 → 59664 [ACK] Seq=1 Ack=193509 Win=4380 Len=0
  175   1.156250 192.168.46.132 → 192.168.70.34 HTTP 4440 [TCP Window Full] Continuation
  176   1.156344 192.168.70.34 → 192.168.46.132 TCP 66 80 → 59664 [ACK] Seq=1 Ack=194969 Win=2920 Len=0
  177   1.156344 192.168.70.34 → 192.168.46.132 TCP 66 80 → 59664 [ACK] Seq=1 Ack=196429 Win=1460 Len=0
  178   1.156416 192.168.70.34 → 192.168.46.132 TCP 66 [TCP ZeroWindow] 80 → 59664 [ACK] Seq=1 Ack=197889 Win=0 Len=0
  179   1.364067 192.168.46.132 → 192.168.70.34 TCP 60 [TCP Keep-Alive] 59664 → 80 [ACK] Seq=197888 Ack=1 Win=64240 Len=0
  180   1.804074 192.168.46.132 → 192.168.70.34 TCP 60 [TCP Keep-Alive] 59664 → 80 [ACK] Seq=197888 Ack=1 Win=64240 Len=0
  181   1.804404 192.168.70.34 → 192.168.46.132 TCP 66 [TCP ZeroWindow] 80 → 59664 [ACK] Seq=1 Ack=197889 Win=0 Len=0
  182   2.635608 192.168.46.132 → 192.168.70.34 TCP 60 [TCP Keep-Alive] 59664 → 80 [ACK] Seq=197888 Ack=1 Win=64240 Len=0
  183   2.635759 192.168.70.34 → 192.168.46.132 TCP 66 [TCP ZeroWindow] 80 → 59664 [ACK] Seq=1 Ack=197889 Win=0 Len=0
  184   3.041776 192.168.70.34 → 192.168.46.132 TCP 181 [TCP ZeroWindow] HTTP/1.0 200 OK  [TCP segment of a reassembled PDU]
  185   3.041810 192.168.46.132 → 192.168.70.34 TCP 60 59664 → 80 [ACK] Seq=197889 Ack=122 Win=64119 Len=0
  186   3.345284 192.168.70.34 → 192.168.46.132 TCP 2540 [TCP ZeroWindow] 80 → 59664 [PSH, ACK] Seq=122 Ack=197889 Win=0 Len=2480 [TCP segment of a reassembled PDU]
  187   3.345363 192.168.46.132 → 192.168.70.34 TCP 60 59664 → 80 [ACK] Seq=197889 Ack=2602 Win=62780 Len=0
  188   3.345602 192.168.70.34 → 192.168.46.132 TCP 5020 [TCP ZeroWindow] 80 → 59664 [PSH, ACK] Seq=2602 Ack=197889 Win=0 Len=4960 [TCP segment of a reassembled PDU]
  189   3.345631 192.168.46.132 → 192.168.70.34 TCP 60 59664 → 80 [ACK] Seq=197889 Ack=7562 Win=61320 Len=0
~~~

### I expected the following

The time_pretransfer is expected to be the timestamp of Packet 175 where the entire POST request including the payload has been sent over the wire so that the difference between time_starttransfer and time_pretransfer can be used to measure the server response time.

### curl/libcurl version

curl 8.2.1 (x86_64-pc-linux-gnu) libcurl/8.2.1 OpenSSL/3.0.9 zlib/1.2.13
Release-Date: 2023-07-26
Protocols: dict file ftp ftps gopher gophers http https imap imaps mqtt pop3 pop3s rtsp smb smbs smtp smtps telnet tftp
Features: alt-svc AsynchDNS HSTS HTTPS-proxy IPv6 Largefile libz NTLM NTLM_WB SSL threadsafe TLS-SRP UnixSockets

### operating system

Linux kali 6.1.0-kali9-amd64 #1 SMP PREEMPT_DYNAMIC Debian 6.1.27-1kali1 (2023-05-12) x86_64 GNU/Linux

**Comment by bagder** [comment]
> The time_pretransfer is expected to be the timestamp of Packet 175 where the entire POST request including the payload has been sent

Then you assume that the transfer the documentation speaks of is the download, right? I don't think that is the intention. The transfer here can be a "body" in either direction.

**Comment by JazJas** [comment]
If it can be either direction, then how the sever respond time can be correctly determined as being documented in time_starttransfer?

"This includes time_pretransfer and also the time the server needed to calculate the result."

Get Outlook for Android<https://aka.ms/AAb9ysg>
________________________________

**Comment by jay** [comment]
If you are doing a POST and curl sends an Expect: 100-continue header and the server replies to that header (telling curl to go ahead and send the POST) then I'm pretty sure that is marked as the starttransfer time. It is the time the first byte is received which may come before your POST is completed.

**Comment by JazJas** [comment]
No, the server will never send any byte of an actual response and only send ACK back to the client until receive the last byte of the POST request from the client. 

You can see the first byte of a response (the response status code) from the server is in Packet 184.

**Comment by bagder** [comment]
> If it can be either direction

It's not an "if", it's clearly how the code works and it also what the documentation says.

> then how the sever respond time can be correctly determined as being documented for time_starttransfer? "This includes time_pretransfer and also the time the server needed to calculate the result."

That could certainly be better expressed.

**Comment by bagder** [comment]
The quote above is from the document of `%{time_pretransfer}` for `-w` and it says in its entirety:

> The time, in seconds, it took from the start until the file transfer was just
> about to begin. This includes all pre-transfer commands and negotiations that
> are specific to the particular protocol(s) involved.

I think this matches what the code does. Even if it is not what @JazJas wishes it is. I don't see a bug here.
