### ISSUE TITLE
Https connection does not reuse

### ISSUE THREAD

**Issue by g10guang** [curl/curl#2828]
### I did this

I read [https://ec.haxx.se/libcurl-connectionreuse.html](https://ec.haxx.se/libcurl-connectionreuse.html) and [https://stackoverflow.com/questions/14141895/curl-to-resuse-https-connection-sessions](https://stackoverflow.com/questions/14141895/curl-to-resuse-https-connection-sessions). I want to test it with the code below.

```c
#include <iostream>
#include "curl/curl.h"

using namespace std;


int writer(char *data, size_t size, size_t nmemb, string *writedata) {
    if (writedata == NULL) return 0;
    writedata->append(data, size*nmemb);
    return size * nmemb;
}


int main() {
    CURL *handle = curl_easy_init();
    string response;

//    curl_easy_setopt(handle, CURLOPT_HTTP_VERSION, CURL_HTTP_VERSION_1_1);

    CURLcode ret = curl_easy_setopt(handle, CURLOPT_WRITEFUNCTION, writer);

    if (ret != CURLE_OK) {
        curl_easy_cleanup(handle);
        cout << "curl set wirte function failed." << endl;
    }

    ret = curl_easy_setopt(handle, CURLOPT_WRITEDATA, &response);

    if (ret != CURLE_OK) {
        curl_easy_cleanup(handle);
        cout << "curl set wirte data failed." << endl;
    }

    const char *url = "https://10.123.11.73:4443/";

    curl_easy_setopt(handle, CURLOPT_SSL_VERIFYPEER, 0L);
    curl_easy_setopt(handle, CURLOPT_SSL_VERIFYHOST, 0L);

    curl_easy_setopt(handle, CURLOPT_URL, url);

    curl_easy_setopt(curl, CURLOPT_TCP_KEEPALIVE, 1L);

    for (int i = 0; i < 3; i++) {
        ret = curl_easy_perform(handle);

        if (ret != CURLE_OK) {
            cout << "curl perform failed." << endl;
        } else {
            cout << "https rsp:" << response << endl << endl << endl;
            response.clear();
        }       
    }

    return 0;
}
```

I use g++ to compile the code:

```
elioliu@DevNet_34_2_sles10sp1:~/code/test/libcurl> g++ -I ~/p/curl-curl-7_54_0/include/ long_connect.cpp -o long_connect ~/p/curl-curl-7_54_0/lib/.libs/libcurl.a ~/localopenssl/lib/libssl.a ~/localopenssl/lib/libcrypto.a -ldl -lrt -lpthread -lz
```

I use tcpdump to catch the network info to check whether the tcp connection is reuse or not.

My curl client's ip: `10.125.34.2`.

```
[root@SWEBVM000017 ~]# sudo tcpdump -v | grep '10\.125\.34\.2' --color=auto
tcpdump: listening on eth1, link-type EN10MB (Ethernet), capture size 65535 bytes
    10.125.34.2.36342 > SWEBVM000017.pharos: Flags [S], cksum 0xc568 (correct), seq 3352960279, win 5840, options [mss 1448,sackOK,TS val 2279153017 ecr 0,nop,wscale 2], length 0
    SWEBVM000017.pharos > 10.125.34.2.36342: Flags [S.], cksum 0x4271 (incorrect -> 0xbfaa), seq 2339107997, ack 3352960280, win 14480, options [mss 1460,sackOK,TS val 2395723014 ecr 2279153017,nop,wscale 7], length 0
    10.125.34.2.36342 > SWEBVM000017.pharos: Flags [.], cksum 0x2153 (correct), ack 1, win 1460, options [nop,nop,TS val 2279153017 ecr 2395723014], length 0
    10.125.34.2.36342 > SWEBVM000017.pharos: Flags [P.], cksum 0xf1a0 (correct), seq 1:518, ack 1, win 1460, options [nop,nop,TS val 2279153017 ecr 2395723014], length 517
    SWEBVM000017.pharos > 10.125.34.2.36342: Flags [.], cksum 0x4269 (incorrect -> 0x2487), ack 518, win 122, options [nop,nop,TS val 2395723015 ecr 2279153017], length 0
    SWEBVM000017.pharos > 10.125.34.2.36342: Flags [P.], cksum 0x45e1 (incorrect -> 0x868b), seq 1:889, ack 518, win 122, options [nop,nop,TS val 2395723015 ecr 2279153017], length 888
    10.125.34.2.36342 > SWEBVM000017.pharos: Flags [.], cksum 0x1a19 (correct), ack 889, win 1904, options [nop,nop,TS val 2279153017 ecr 2395723015], length 0
    10.125.34.2.36342 > SWEBVM000017.pharos: Flags [P.], cksum 0xe31b (correct), seq 518:836, ack 889, win 1904, options [nop,nop,TS val 2279153018 ecr 2395723015], length 318
    SWEBVM000017.pharos > 10.125.34.2.36342: Flags [P.], cksum 0x429c (incorrect -> 0x57df), seq 889:940, ack 836, win 130, options [nop,nop,TS val 2395723016 ecr 2279153018], length 51
    10.125.34.2.36342 > SWEBVM000017.pharos: Flags [P.], cksum 0x8051 (correct), seq 836:921, ack 940, win 1904, options [nop,nop,TS val 2279153019 ecr 2395723016], length 85
    SWEBVM000017.pharos > 10.125.34.2.36342: Flags [P.], cksum 0x4297 (incorrect -> 0xe40a), seq 940:986, ack 921, win 130, options [nop,nop,TS val 2395723016 ecr 2279153019], length 46
    SWEBVM000017.pharos > 10.125.34.2.36342: Flags [FP.], cksum 0x461d (incorrect -> 0xccde), seq 986:1934, ack 921, win 130, options [nop,nop,TS val 2395723016 ecr 2279153019], length 948
    10.125.34.2.36342 > SWEBVM000017.pharos: Flags [.], cksum 0x1293 (correct), ack 1935, win 2378, options [nop,nop,TS val 2279153019 ecr 2395723016], length 0
    10.125.34.2.36342 > SWEBVM000017.pharos: Flags [P.], cksum 0xb4ae (correct), seq 921:952, ack 1935, win 2378, options [nop,nop,TS val 2279153019 ecr 2395723016], length 31
    SWEBVM000017.pharos > 10.125.34.2.36342: Flags [R], cksum 0x46b4 (correct), seq 2339109932, win 0, length 0
    10.125.34.2.36342 > SWEBVM000017.pharos: Flags [F.], cksum 0x1273 (correct), seq 952, ack 1935, win 2378, options [nop,nop,TS val 2279153019 ecr 2395723016], length 0
    SWEBVM000017.pharos > 10.125.34.2.36342: Flags [R], cksum 0x46b4 (correct), seq 2339109932, win 0, length 0
    10.125.34.2.36343 > SWEBVM000017.pharos: Flags [S], cksum 0xfcf5 (correct), seq 3353339265, win 5840, options [mss 1448,sackOK,TS val 2279153019 ecr 0,nop,wscale 2], length 0
    SWEBVM000017.pharos > 10.125.34.2.36343: Flags [S.], cksum 0x4271 (incorrect -> 0x3379), seq 1829492410, ack 3353339266, win 14480, options [mss 1460,sackOK,TS val 2395723016 ecr 2279153019,nop,wscale 7], length 0
    10.125.34.2.36343 > SWEBVM000017.pharos: Flags [.], cksum 0x9521 (correct), ack 1, win 1460, options [nop,nop,TS val 2279153019 ecr 2395723016], length 0
    10.125.34.2.36343 > SWEBVM000017.pharos: Flags [P.], cksum 0x6897 (correct), seq 1:518, ack 1, win 1460, options [nop,nop,TS val 2279153019 ecr 2395723016], length 517
    SWEBVM000017.pharos > 10.125.34.2.36343: Flags [.], cksum 0x4269 (incorrect -> 0x9855), ack 518, win 122, options [nop,nop,TS val 2395723017 ecr 2279153019], length 0
    SWEBVM000017.pharos > 10.125.34.2.36343: Flags [P.], cksum 0x45e1 (incorrect -> 0x6b56), seq 1:889, ack 518, win 122, options [nop,nop,TS val 2395723017 ecr 2279153019], length 888
    10.125.34.2.36343 > SWEBVM000017.pharos: Flags [.], cksum 0x8de7 (correct), ack 889, win 1904, options [nop,nop,TS val 2279153019 ecr 2395723017], length 0
    10.125.34.2.36343 > SWEBVM000017.pharos: Flags [P.], cksum 0x0d0b (correct), seq 518:836, ack 889, win 1904, options [nop,nop,TS val 2279153020 ecr 2395723017], length 318
    SWEBVM000017.pharos > 10.125.34.2.36343: Flags [P.], cksum 0x429c (incorrect -> 0xe139), seq 889:940, ack 836, win 130, options [nop,nop,TS val 2395723018 ecr 2279153020], length 51
    10.125.34.2.36343 > SWEBVM000017.pharos: Flags [P.], cksum 0x0789 (correct), seq 836:921, ack 940, win 1904, options [nop,nop,TS val 2279153021 ecr 2395723018], length 85
    SWEBVM000017.pharos > 10.125.34.2.36343: Flags [P.], cksum 0x4297 (incorrect -> 0x0a43), seq 940:986, ack 921, win 130, options [nop,nop,TS val 2395723018 ecr 2279153021], length 46
    SWEBVM000017.pharos > 10.125.34.2.36343: Flags [FP.], cksum 0x461d (incorrect -> 0x4649), seq 986:1934, ack 921, win 130, options [nop,nop,TS val 2395723018 ecr 2279153021], length 948
    10.125.34.2.36343 > SWEBVM000017.pharos: Flags [.], cksum 0x8661 (correct), ack 1935, win 2378, options [nop,nop,TS val 2279153021 ecr 2395723018], length 0
    10.125.34.2.36343 > SWEBVM000017.pharos: Flags [P.], cksum 0x2886 (correct), seq 921:952, ack 1935, win 2378, options [nop,nop,TS val 2279153021 ecr 2395723018], length 31
    SWEBVM000017.pharos > 10.125.34.2.36343: Flags [R], cksum 0x82f6 (correct), seq 1829494345, win 0, length 0
    10.125.34.2.36343 > SWEBVM000017.pharos: Flags [F.], cksum 0x8641 (correct), seq 952, ack 1935, win 2378, options [nop,nop,TS val 2279153021 ecr 2395723018], length 0
    SWEBVM000017.pharos > 10.125.34.2.36343: Flags [R], cksum 0x82f6 (correct), seq 1829494345, win 0, length 0
    10.125.34.2.36344 > SWEBVM000017.pharos: Flags [S], cksum 0x074b (correct), seq 3350780752, win 5840, options [mss 1448,sackOK,TS val 2279153021 ecr 0,nop,wscale 2], length 0
    SWEBVM000017.pharos > 10.125.34.2.36344: Flags [S.], cksum 0x4271 (incorrect -> 0x2533), seq 4263468607, ack 3350780753, win 14480, options [mss 1460,sackOK,TS val 2395723018 ecr 2279153021,nop,wscale 7], length 0
    10.125.34.2.36344 > SWEBVM000017.pharos: Flags [.], cksum 0x86db (correct), ack 1, win 1460, options [nop,nop,TS val 2279153021 ecr 2395723018], length 0
    10.125.34.2.36344 > SWEBVM000017.pharos: Flags [P.], cksum 0x3f33 (correct), seq 1:518, ack 1, win 1460, options [nop,nop,TS val 2279153021 ecr 2395723018], length 517
    SWEBVM000017.pharos > 10.125.34.2.36344: Flags [.], cksum 0x4269 (incorrect -> 0x8a10), ack 518, win 122, options [nop,nop,TS val 2395723018 ecr 2279153021], length 0
    SWEBVM000017.pharos > 10.125.34.2.36344: Flags [P.], cksum 0x45e1 (incorrect -> 0xe38d), seq 1:889, ack 518, win 122, options [nop,nop,TS val 2395723018 ecr 2279153021], length 888
    10.125.34.2.36344 > SWEBVM000017.pharos: Flags [.], cksum 0x7fa2 (correct), ack 889, win 1904, options [nop,nop,TS val 2279153021 ecr 2395723018], length 0
    10.125.34.2.36344 > SWEBVM000017.pharos: Flags [P.], cksum 0x8148 (correct), seq 518:836, ack 889, win 1904, options [nop,nop,TS val 2279153021 ecr 2395723018], length 318
    SWEBVM000017.pharos > 10.125.34.2.36344: Flags [P.], cksum 0x429c (incorrect -> 0xb92f), seq 889:940, ack 836, win 130, options [nop,nop,TS val 2395723019 ecr 2279153021], length 51
    10.125.34.2.36344 > SWEBVM000017.pharos: Flags [P.], cksum 0x81a9 (correct), seq 836:921, ack 940, win 1904, options [nop,nop,TS val 2279153022 ecr 2395723019], length 85
    SWEBVM000017.pharos > 10.125.34.2.36344: Flags [P.], cksum 0x4297 (incorrect -> 0xba4d), seq 940:986, ack 921, win 130, options [nop,nop,TS val 2395723020 ecr 2279153022], length 46
    SWEBVM000017.pharos > 10.125.34.2.36344: Flags [FP.], cksum 0x461d (incorrect -> 0x30a7), seq 986:1934, ack 921, win 130, options [nop,nop,TS val 2395723020 ecr 2279153022], length 948
    10.125.34.2.36344 > SWEBVM000017.pharos: Flags [.], cksum 0x781b (correct), ack 1935, win 2378, options [nop,nop,TS val 2279153023 ecr 2395723020], length 0
    10.125.34.2.36344 > SWEBVM000017.pharos: Flags [P.], cksum 0x56df (correct), seq 921:952, ack 1935, win 2378, options [nop,nop,TS val 2279153023 ecr 2395723020], length 31
    SWEBVM000017.pharos > 10.125.34.2.36344: Flags [R], cksum 0x6a5c (correct), seq 4263470542, win 0, length 0
    10.125.34.2.36344 > SWEBVM000017.pharos: Flags [F.], cksum 0x77fb (correct), seq 952, ack 1935, win 2378, options [nop,nop,TS val 2279153023 ecr 2395723020], length 0
    SWEBVM000017.pharos > 10.125.34.2.36344: Flags [R], cksum 0x6a5c (correct), seq 4263470542, win 0, length 0
```

**Every request uses different tcp port:  36344    36343     36342**

### I expected the following

I expect three https request use the same tcp connection with same port.

### curl/libcurl version

```
curl-curl-7_54_0
```

### operating system

Linux.

**Comment by dfandrich** [comment]
The best forum for questions is the curl-library mailing list.  Are you sure
the server supports persistent connections? Please show the headers sent by the
server.

**Comment by g10guang** [comment]
I add `curl_easy_setopt(handle, CURLOPT_VERBOSE, 1L);`. And the message curl output:

**Comment by dfandrich** [comment]
In this case the answer is in this line:

* HTTP 1.0, assume close after body

The HTTP server supports only HTTP 1.0 and therefore does not support
persistent connections.

**Comment by g10guang** [comment]
@dfandrich The 2nd and 3rd use HTTP 1.1. Why does the 2nd request close?

**Comment by dfandrich** [comment]
Can you see an instance where the server responds with anything other than
HTTP/1.0? I can't.

**Comment by g10guang** [comment]
Yes, you are right. Thank you. @dfandrich
