### ISSUE TITLE
Connection #0 left intact on 1 url in -v output

### ISSUE THREAD

**Issue by hkskoglund** [curl/curl#2165]
### I did this

```
[henning@satellite SLEEPLAB]$ IPCAM=192.168.0.110; curl --anyauth -u admin: -v  --compressed -e "http://$IPCAM/eng/admin/adv_sdcard.cgi" -O "http://$IPCAM/cgi/admin/getSDFile.cgi?file=20171206_062136.mp4&path=DCS-936L/20171206/06/20171206_062136.mp4"
*   Trying 192.168.0.110...
* TCP_NODELAY set
  % Total    % Received % Xferd  Average Speed   Time    Time     Time  Current
                                 Dload  Upload   Total   Spent    Left  Speed
  0     0    0     0    0     0      0      0 --:--:-- --:--:-- --:--:--     0* Connected to 192.168.0.110 (192.168.0.110) port 80 (#0)
> GET /cgi/admin/getSDFile.cgi?file=20171206_062136.mp4&path=DCS-936L/20171206/06/20171206_062136.mp4 HTTP/1.1
> Host: 192.168.0.110
> User-Agent: curl/7.55.1
> Accept: */*
> Accept-Encoding: deflate, gzip
> Referer: http://192.168.0.110/eng/admin/adv_sdcard.cgi
> 
  0     0    0     0    0     0      0      0 --:--:-- --:--:-- --:--:--     0< HTTP/1.1 200 OK
< X-Frame-Options: SAMEORIGIN
< X-Content-Type-Options: nosniff
< X-XSS-Protection: 1;mode=block
< Content-Type: binary/octet-stream
< Content-Length: 6375022
< Content-Disposition: attachment; filename=20171206_062136.mp4
< Content-Description: exported configuration file
< Date: Fri, 08 Dec 2017 06:41:06 GMT
< Server: dcs-lig-httpd
< 
{ [2550 bytes data]
100 6225k  100 6225k    0     0   778k      0  0:00:08  0:00:08 --:--:--  718k
* Connection #0 to host 192.168.0.110 left intact
```

### I expected the following
Why is the connection left intact?

tcpdump: connection is finished

```
[henning@satellite SLEEPLAB]$ sudo tcpdump  'tcp[tcpflags] & (tcp-syn|tcp-fin) != 0 and host 192.168.0.110'

07:41:06.960811 IP satellite.52844 > 192.168.0.110.http: Flags [S], seq 3075366818, win 29200, options [mss 1460,sackOK,TS val 2092419272 ecr 0,nop,wscale 7], length 0
07:41:06.965800 IP 192.168.0.110.http > satellite.52844: Flags [S.], seq 2545340795, ack 3075366819, win 14480, options [mss 1460,sackOK,TS val 14996387 ecr 2092419272,nop,wscale 2], length 0
07:41:15.805501 IP satellite.52844 > 192.168.0.110.http: Flags [F.], seq 260, ack 6375369, win 2693, options [nop,nop,TS val 2092428117 ecr 14997270], length 0
07:41:15.926026 IP 192.168.0.110.http > satellite.52844: Flags [F.], seq 6375369, ack 261, win 3888, options [nop,nop,TS val 14997283 ecr 2092428117], length 0
```

### curl/libcurl version

```
curl 7.55.1 (x86_64-redhat-linux-gnu) libcurl/7.55.1 OpenSSL/1.1.0g zlib/1.2.11 libidn2/2.0.4 libpsl/0.18.0 (+libidn2/2.0.3) libssh2/1.8.0 nghttp2/1.25.0
Release-Date: 2017-08-14
Protocols: dict file ftp ftps gopher http https imap imaps ldap ldaps pop3 pop3s rtsp scp sftp smb smbs smtp smtps telnet tftp 
Features: AsynchDNS IDN IPv6 Largefile GSS-API Kerberos SPNEGO NTLM NTLM_WB SSL libz TLS-SRP HTTP2 UnixSockets HTTPS-proxy Metalink PSL 
```

### operating system

```
[henning@satellite SLEEPLAB]$ cat /etc/fedora-release ; uname -a
Fedora release 27 (Twenty Seven)
Linux satellite 4.13.16-302.fc27.x86_64 #1 SMP Thu Nov 30 15:33:36 UTC 2017 x86_64 x86_64 x86_64 GNU/Linu
```x

**Comment by bagder** [comment]
It is not being closed as a consequence of the transfer. The server allowed it to stay open and curl had no reason to close it after the transfer was complete. That output happens in the last state of the transfer and that logic doesn't know what happens next: if there's another transfer that will start or if it ends there.

Then it was closed anyway of course since curl, the application, exited and then it closes and frees everything.
