### ISSUE TITLE
HTTP/3 not responding to retries

### ISSUE THREAD

**Issue by natesales** [curl/curl#6325]
I'm having some trouble with curl's HTTP/3 client not responding to QUIC retry packets.

### I did this

~/apps/http3/curl/src ▴ ./curl -v -I --http3 https://arix.dev
*   Trying 2a0e:8f00:fe04::4:443...
* Sent QUIC client Initial, ALPN: h3-29,h3-28,h3-27
*   Trying 66.248.234.4:443...
* Sent QUIC client Initial, ALPN: h3-29,h3-28,h3-27
* After 149794ms connect time, move on!
* connect to 2a0e:8f00:fe04::4 port 443 failed: Connection timed out
* After 149794ms connect time, move on!
* connect to 66.248.234.4 port 443 failed: Connection timed out
* Failed to connect to arix.dev port 443: Connection timed out
* Closing connection 0
curl: (28) Failed to connect to arix.dev port 443: Connection timed out

Looking at a packet capture, I can see the outgoing QUIC UDP packets but nothing back from the server:
```
15:11:37.054752 IP6 altair.38532 > 2a0e:8f00:fe04::4.443: UDP, length 1200
15:11:38.053579 IP6 altair.38532 > 2a0e:8f00:fe04::4.443: UDP, length 1200
15:11:40.051591 IP6 altair.38532 > 2a0e:8f00:fe04::4.443: UDP, length 1200
```

Additionally, the server is sending retries but not receiving a response:

```
2020/12/08 15:49:31 server <- Received Initial packet.
2020/12/08 15:49:31 server 	Long Header{Type: Initial, DestConnectionID: 0x563ef68cdcc131aeb4c9b4a8e2fde47b, SrcConnectionID: 0x909cdc671fc07c3c98cd902ad96a69a63a8d8ecd, Token: (empty), PacketNumber: 0, PacketNumberLen: 0, Length: 1154, Version: QUIC WG draft-29}
2020/12/08 15:49:31 server Changing connection ID to 0x663f8cbf.
2020/12/08 15:49:31 server -> Sending Retry
2020/12/08 15:49:31 server 	Long Header{Type: Retry, DestConnectionID: 0x909cdc671fc07c3c98cd902ad96a69a63a8d8ecd, SrcConnectionID: 0x663f8cbf, Token: 0x156993<truncated>48855, Version: QUIC WG draft-29}
2020/12/08 15:49:31 server <- Received Initial packet.
2020/12/08 15:49:31 server 	Long Header{Type: Initial, DestConnectionID: 0xb4bd905bc27719bc880db550c6e1fbb8, SrcConnectionID: 0x99772582c7d3a4ca98fb5c3fa5c43230701c4f32, Token: (empty), PacketNumber: 0, PacketNumberLen: 0, Length: 1154, Version: QUIC WG draft-29}
2020/12/08 15:49:31 server Changing connection ID to 0xa5fc3b75.
2020/12/08 15:49:31 server -> Sending Retry
2020/12/08 15:49:31 server 	Long Header{Type: Retry, DestConnectionID: 0x99772582c7d3a4ca98fb5c3fa5c43230701c4f32, SrcConnectionID: 0xa5fc3b75, Token: 0x91833f<truncated>8f2a, Version: QUIC WG draft-29}
2020/12/08 15:49:32 server <- Received Initial packet.
2020/12/08 15:49:32 server 	Long Header{Type: Initial, DestConnectionID: 0x563ef68cdcc131aeb4c9b4a8e2fde47b, SrcConnectionID: 0x909cdc671fc07c3c98cd902ad96a69a63a8d8ecd, Token: (empty), PacketNumber: 0, PacketNumberLen: 0, Length: 1154, Version: QUIC WG draft-29}
2020/12/08 15:49:32 server Changing connection ID to 0xdb3ee922.
2020/12/08 15:49:32 server -> Sending Retry
2020/12/08 15:49:32 server 	Long Header{Type: Retry, DestConnectionID: 0x909cdc671fc07c3c98cd902ad96a69a63a8d8ecd, SrcConnectionID: 0xdb3ee922, Token: 0x80c<truncated>e71d8d, Version: QUIC WG draft-29}
2020/12/08 15:49:32 server <- Received Initial packet.
2020/12/08 15:49:32 server 	Long Header{Type: Initial, DestConnectionID: 0xb4bd905bc27719bc880db550c6e1fbb8, SrcConnectionID: 0x99772582c7d3a4ca98fb5c3fa5c43230701c4f32, Token: (empty), PacketNumber: 0, PacketNumberLen: 0, Length: 1154, Version: QUIC WG draft-29}
```

I've also opened an issue with the QUIC implementation of the webserver https://github.com/lucas-clemente/quic-go/issues/2922 in which I was asked to open an issue with the client.

### I expected the following

The client should establish a QUIC transport connection with the server and complete the HTTP request.

### curl/libcurl version

~/apps/http3/curl/src ▴ ./curl -V
curl 7.74.0-DEV (x86_64-pc-linux-gnu) libcurl/7.74.0-DEV BoringSSL zlib/1.2.11 quiche/0.6.0
Release-Date: [unreleased]
Protocols: dict file ftp ftps gopher http https imap imaps mqtt pop3 pop3s rtsp smb smbs smtp smtps telnet tftp 
Features: alt-svc AsynchDNS HTTP3 HTTPS-proxy IPv6 Largefile libz NTLM NTLM_WB SSL UnixSockets

### operating system

Distributor ID:	Debian
Description:	Debian GNU/Linux 10 (buster)
Release:	10
Codename:	buster

Linux altair 4.19.0-13-amd64 #1 SMP Debian 4.19.160-2 (2020-11-28) x86_64 GNU/Linux

**Comment by ghedo** [comment]
Hello, it would be useful if you could collect a PCAP of the connection, so we can look into what's going on in more detail.

**Comment by bagder** [comment]
@natesales nothing? We need more details

**Comment by bagder** [comment]
No response, closing
