### ISSUE TITLE
HTTP/2 end of the underlying stream

### ISSUE THREAD

**Issue by steini2000** [curl/curl#8809]
I'm using curl for a HTTP/2 connection to nginx. Over this connection
multiple requests (GET and POST) are sent.

For testing, nginx sends GOAWAY after 20 requests:
keepalive_requests 20;

In some cases I'm getting:
Stream error in the HTTP/2 framing layer
HTTP/2 stream 0 was not closed cleanly before end of the underlying stream

I can not find a huge difference in the Wireshark trace
between good and bad case. In both cases, last stream id in the
GOAWAY frame ist 39.

Good case:
```
No.     Time               Source                Destination           Protocol Length Info
   5734 16:46:19,078509226 192.168.100.10        10.10.168.192         HTTP2    180    HEADERS[37]: GET /get
   5735 16:46:19,106224983 10.10.168.192         192.168.100.10        TCP      66     443 → 51457 [ACK] Seq=6448 Ack=3148 Win=64640 Len=0 TSval=2736051059 TSecr=7674720
   5736 16:46:28,083427727 192.168.100.10        10.10.168.192         HTTP2    181    HEADERS[39]: POST /post
   5737 16:46:28,097141262 192.168.100.10        10.10.168.192         HTTP2    104    DATA[39]
   5738 16:46:28,114231265 10.10.168.192         192.168.100.10        TCP      66     443 → 51457 [ACK] Seq=6448 Ack=3263 Win=64640 Len=0 TSval=2736060065 TSecr=7683725
   5739 16:46:28,114253277 10.10.168.192         192.168.100.10        HTTP2    125    GOAWAY[0], WINDOW_UPDATE[39]
   5740 16:46:28,115036428 192.168.100.10        10.10.168.192         TCP      66     51457 → 443 [ACK] Seq=3301 Ack=6507 Win=42256 Len=0 TSval=7683757 TSecr=2736060066
   5741 16:46:28,166100632 10.10.168.192         192.168.100.10        TCP      66     443 → 51457 [ACK] Seq=6507 Ack=3301 Win=64640 Len=0 TSval=2736060117 TSecr=7683739
   5742 16:46:28,166119624 10.10.168.192         192.168.100.10        HTTP2    283    HEADERS[39]: 200 OK
   5743 16:46:28,167039893 192.168.100.10        10.10.168.192         TCP      66     51457 → 443 [ACK] Seq=3301 Ack=6724 Win=42256 Len=0 TSval=7683809 TSecr=2736060119
   5744 16:46:39,112704044 10.10.168.192         192.168.100.10        HTTP2    281    HEADERS[37]: 200 OK
   5745 16:46:39,112719439 10.10.168.192         192.168.100.10        TLSv1.2  97     Alert (Level: Warning, Description: Close Notify)
   5746 16:46:39,113370629 192.168.100.10        10.10.168.192         TCP      66     51457 → 443 [ACK] Seq=3301 Ack=6939 Win=42256 Len=0 TSval=7694755 TSecr=2736071063
   5747 16:46:39,153908439 192.168.100.10        10.10.168.192         TCP      66     51457 → 443 [ACK] Seq=3301 Ack=6971 Win=42256 Len=0 TSval=7694796 TSecr=2736071063
   5748 16:46:39,205306560 192.168.100.10        10.10.168.192         TLSv1.2  97     Alert (Level: Warning, Description: Close Notify)
```

Bad case:
```
No.     Time               Source                Destination           Protocol Length Info
   6314 17:00:37,494768392 192.168.100.10        10.10.168.192         HTTP2    180    HEADERS[37]: GET /get
   6315 17:00:37,577219872 10.10.168.192         192.168.100.10        TCP      66     443 → 51461 [ACK] Seq=6545 Ack=3177 Win=64384 Len=0 TSval=2736909553 TSecr=8533138
   6318 17:00:57,490633192 192.168.100.10        10.10.168.192         HTTP2    181    HEADERS[39]: POST /post
   6319 17:00:57,504424149 192.168.100.10        10.10.168.192         HTTP2    104    DATA[39]
   6320 17:00:57,518901326 10.10.168.192         192.168.100.10        TCP      66     443 → 51461 [ACK] Seq=6545 Ack=3292 Win=64384 Len=0 TSval=2736929495 TSecr=8553134
   6321 17:00:57,520572778 10.10.168.192         192.168.100.10        HTTP2    125    GOAWAY[0], WINDOW_UPDATE[39]
   6322 17:00:57,521196460 192.168.100.10        10.10.168.192         TCP      66     51461 → 443 [ACK] Seq=3330 Ack=6604 Win=42256 Len=0 TSval=8553165 TSecr=2736929496
   6323 17:00:57,535197097 10.10.168.192         192.168.100.10        HTTP2    283    HEADERS[39]: 200 OK
   6324 17:00:57,535827596 192.168.100.10        10.10.168.192         TCP      66     51461 → 443 [ACK] Seq=3330 Ack=6821 Win=42256 Len=0 TSval=8553179 TSecr=2736929512
   6325 17:00:57,538974114 10.10.168.192         192.168.100.10        HTTP2    279    HEADERS[37]: 200 OK
   6326 17:00:57,538991264 10.10.168.192         192.168.100.10        TLSv1.2  97     Alert (Level: Warning, Description: Close Notify)
   6327 17:00:57,539061909 10.10.168.192         192.168.100.10        TCP      66     443 → 51461 [FIN, ACK] Seq=7065 Ack=3330 Win=64384 Len=0 TSval=2736929515 TSecr=8553148
   6328 17:00:57,539680064 192.168.100.10        10.10.168.192         TCP      66     51461 → 443 [ACK] Seq=3330 Ack=7034 Win=42256 Len=0 TSval=8553183 TSecr=2736929515
   6329 17:00:57,539868027 192.168.100.10        10.10.168.192         TCP      66     51461 → 443 [ACK] Seq=3330 Ack=7065 Win=42256 Len=0 TSval=8553183 TSecr=2736929515
   6330 17:00:57,580196357 192.168.100.10        10.10.168.192         TCP      66     51461 → 443 [ACK] Seq=3330 Ack=7066 Win=42256 Len=0 TSval=8553224 TSecr=2736929515
   6331 17:00:57,737627248 192.168.100.10        10.10.168.192         TLSv1.2  97     Alert (Level: Warning, Description: Close Notify)

```

But there is a difference in the curl debug log.
The logs starts where the logs differ: http2_recv for the POST request.
US = POST request, DS = GET request

Good case:
```
16:46:28  US Info: http2_recv: easy 0xb5c00468 (stream 0) win 33554432/4294967295
16:46:28  US Info: h2_process_pending_input: All data in connection buffer processed
16:46:28  US Info: http2_recv returns 0, http2_handle_stream_close
16:46:28  US <7983890> <= Recv data: size = 0
16:46:28  US Info: http2_recv: easy 0xb5c00468 (stream 0) win 33554432/4294967295
16:46:28  US Info: DONE the pause stream (0)
16:46:39  DS Info: http2_recv: easy 0xb5c311b0 (stream 37) win 33554432/33554432
16:46:39  DS <7994756> <= Recv SSL data: size = 5
16:46:39      '^W^C^C'
16:46:39  DS Info: nread=186
16:46:39  DS Info: on_begin_headers() was called
16:46:39  DS Info: h2 status: HTTP/2 200 (easy 0xb5c311b0)
16:46:39  DS Info: h2 header: server: nginx/1.21.0
16:46:39  DS Info: h2 header: date: Thu, 05 May 2022 16:46:39 GMT
16:46:39  DS Info: h2 header: content-type: application/octet-stream
16:46:39  DS Info: h2 header: content-length: 0
16:46:39  DS Info: h2 header: cache-control: no-store
16:46:39  DS Info: on_frame_recv() header 1 stream 25
16:46:39  DS Info: Store 297 bytes headers from stream 37 at 0xb5c0a258
16:46:39  DS Info: on_stream_close(), NO_ERROR (err 0), stream 37
16:46:39  DS Info: Removed stream 37 hash
16:46:39  DS Info: h2_process_pending_input: All data in connection buffer processed
16:46:39  DS Info: http2_recv: returns 297 for stream 0
16:46:39  DS Info: Data returned for PAUSED stream 0
16:46:39  DS <7994775> <= Recv header: size = 13
16:46:39      'HTTP/2 200 ^M '
16:46:39  DS <7994779> <= Recv header: size = 22
16:46:39      'server: nginx/1.21.0^M '
16:46:39  DS <7994784> <= Recv header: size = 37
16:46:39      'date: Thu, 05 May 2022 16:46:39 GMT^M '
16:46:39  DS <7994788> <= Recv header: size = 40
16:46:39      'content-type: application/octet-stream^M '
16:46:39  DS <7994791> <= Recv header: size = 19
16:46:39      'content-length: 0^M '
16:46:39  DS <7994795> <= Recv header: size = 25
16:46:39      'cache-control: no-store^M '
16:46:39  DS <7994822> <= Recv header: size = 2
16:46:39      '^M '
16:46:39  DS Info: http2_recv: easy 0xb5c311b0 (stream 0) win 33554432/4294967295
16:46:39  DS <7994826> <= Recv SSL data: size = 5
16:46:39      '^U^C^C'
16:46:39  DS Info: TLSv1.2 (IN), TLS alert, close notify (256):
16:46:39  DS <7994830> <= Recv SSL data: size = 2
16:46:39      '^A'
16:46:39  DS Info: end of stream
16:46:39  DS <7994834> <= Recv data: size = 0
16:46:39  DS Info: http2_recv: easy 0xb5c311b0 (stream 0) win 33554432/4294967295
16:46:39  DS Info: end of stream
16:46:39  DS Info: DONE the pause stream (0)
16:46:39  DS Info: HTTP/2 DISCONNECT starts now
16:46:39  DS Info: HTTP/2 DISCONNECT done
16:46:39  DS Info: Closing connection 41
16:46:39  DS <7994844> => Send SSL data: size = 5
16:46:39      '^U^C^C'
16:46:39  DS Info: TLSv1.2 (OUT), TLS alert, close notify (256):
16:46:39  DS <7994848> => Send SSL data: size = 2
16:46:39      '^A'

```

Bad case:
```
17:00:57  US Info: http2_recv: easy 0xb5c43638 (stream 0) win 33554371/4294967295
17:00:57  US <8853256> <= Recv SSL data: size = 5
17:00:57      '^W^C^C'
17:00:57  US Info: nread=184
17:00:57  DS Info: on_begin_headers() was called
17:00:57  DS Info: h2 status: HTTP/2 200 (easy 0xb5c1ab48)
17:00:57  DS Info: h2 header: server: nginx/1.21.0
17:00:57  DS Info: h2 header: date: Thu, 05 May 2022 17:00:57 GMT
17:00:57  DS Info: h2 header: content-type: application/octet-stream
17:00:57  DS Info: h2 header: content-length: 0
17:00:57  DS Info: h2 header: cache-control: no-store
17:00:57  DS Info: on_frame_recv() header 1 stream 25
17:00:57  DS Info: Store 296 bytes headers from stream 37 at 0xb5c25e38
17:00:57  DS Info: on_stream_close(), NO_ERROR (err 0), stream 37
17:00:57  DS Info: Removed stream 37 hash
17:00:57  US Info: h2_process_pending_input: All data in connection buffer processed
17:00:57  US Info: h2_process_pending_input: All data in connection buffer processed
17:00:57  US Info: http2_recv returns 0, http2_handle_stream_close
17:00:57  US <8853285> <= Recv data: size = 0
17:00:57  US Info: http2_recv: easy 0xb5c43638 (stream 0) win 33554371/4294967295
17:00:57  US <8853289> <= Recv SSL data: size = 5
17:00:57      '^U^C^C'
17:00:57  US Info: TLSv1.2 (IN), TLS alert, close notify (256):
17:00:57  US <8853293> <= Recv SSL data: size = 2
17:00:57      '^A'
17:00:57  US Info: HTTP/2 stream 0 was not closed cleanly before end of the underlying stream
17:00:57  US Info: DONE the pause stream (0)
17:00:57  US Info: RST stream 0
17:00:57  DS Info: http2_recv: easy 0xb5c1ab48 (stream 0) win 33554371/4294967295
17:00:57  DS Info: http2_recv: DRAIN 296 bytes stream 0 (0xb5c25e38 => 0xb5c25e38)
17:00:57  DS Info: h2_process_pending_input: All data in connection buffer processed
17:00:57  DS Info: http2_recv: returns 296 for stream 0
17:00:57  DS Info: Data returned for PAUSED stream 0
17:00:57  DS <8853318> <= Recv header: size = 13
17:00:57      'HTTP/2 200 ^M '
17:00:57  DS <8853322> <= Recv header: size = 22
17:00:57      'server: nginx/1.21.0^M '
17:00:57  DS <8853326> <= Recv header: size = 37
17:00:57      'date: Thu, 05 May 2022 17:00:57 GMT^M '
17:00:57  DS <8853329> <= Recv header: size = 40
17:00:57      'content-type: application/octet-stream^M '
17:00:57  DS <8853333> <= Recv header: size = 19
17:00:57      'content-length: 0^M '
17:00:57  DS <8853337> <= Recv header: size = 25
17:00:57      'cache-control: no-store^M '
17:00:57  DS <8853363> <= Recv header: size = 2
17:00:57      '^M '
17:00:57  DS Info: http2_recv: easy 0xb5c1ab48 (stream 0) win 33554371/4294967295
17:00:57  DS Info: end of stream
17:00:57  DS <8853368> <= Recv data: size = 0
17:00:57  DS Info: http2_recv: easy 0xb5c1ab48 (stream 0) win 33554371/4294967295
17:00:57  DS Info: end of stream
17:00:57  DS Info: DONE the pause stream (0)
17:00:57  DS Info: HTTP/2 DISCONNECT starts now
17:00:57  DS Info: HTTP/2 DISCONNECT done
17:00:57  DS Info: Closing connection 45
17:00:57  DS <8853378> => Send SSL data: size = 5
17:00:57      '^U^C^C'
17:00:57  DS Info: TLSv1.2 (OUT), TLS alert, close notify (256):
17:00:57  DS <8853383> => Send SSL data: size = 2
17:00:57      '^A'

```

The stream error only happens if the TLS record contains GOAWAY and WINDOW_UPDATE
frame, not if the TLS record contains only the GOAWAY frame.
But there are also cases without stream error but GOAWAY and WINDOW_UPDATE together in
one TLS record (see above).

Issue #6936 could be related (known bugs).
The stream error has been added for issue #6736.

I am pretty confident that no data is lost and it should not be an error.
For my application, as workaround I just repeat the request in question.
I do not have a test case to share. I am willing to provide more
information or improve libcurl. But I need some suggestions.

curl 7.83.0 (arm-none-linux-gnueabi) libcurl/7.83.0 OpenSSL/1.0.2g zlib/1.2.5 nghttp2/1.41.0

**Comment by bagder** [comment]
We have done a lot of changes in the HTTP/2 department recently, so it would be very helpful if you could try the latest git or perhaps tomorrow's 7.88.0 release and give this another shot to see if the problems perhaps are gone, or different now!

**Comment by bagder** [comment]
> We've been noticing this error with curl 8.0.1 when used with Cloudflare.

1. Without a way for us to reproduce, this is mostly just added noise. Could be a different problem. Could be a server-side thing.
2. The nixOS issue https://github.com/NixOS/nix/issues/1254 mentions *cloudfront* (not Cloudflare) and even Fastly in a comment.

**Comment by domenkozar** [comment]
1. To reproduce you can use an URL like https://nix-community.cachix.org/nar/238cd6b68a2f1c9bef0fd3fb90dc924ad33c34c16df8502ccc46463a7b491370.nar.zst, it seems that the error happens during streaming the data to a local file.

There might be something related to [how we invoke curl](https://github.com/NixOS/nix/blob/cf8effdae25bac889533cff86d637512f4f74bf8/src/libstore/filetransfer.cc) and conditions like many threads downloading at the same time from the connection pool.

2. The reports later all refer to https://cachix.org, which I'm the owner of and it uses Cloudflare.

**Comment by bagder** [comment]
> To reproduce you can use an URL like

Does not reproduce with 7.88.1 or git master for me (on Debian):

~~~
$ curl -v https://nix-community.cachix.org/nar/238cd6b68a2f1c9bef0fd3fb90dc924ad33c34c16df8502ccc46463a7b491370.nar.zst -o /dev/null
...
100  125M  100  125M    0     0  66.4M      0  0:00:01  0:00:01 --:--:-- 66.4M
* Connection #0 to host nix-community.cachix.org left intact
$ echo $?
0
~~~

**Comment by bagder** [comment]
Even more HTTP/2 related changes have been done since then. It would be good to have this tested again with curl master or the 8.1.0 release (shipping tomorrow, May 17).

**Comment by bagder** [comment]
We believe this is fixed.
