### ISSUE TITLE
After libcurl exit, kernel keeps sending packet.

### ISSUE THREAD

**Issue by g10guang** [curl/curl#2877]
### I did this

My simple code:

```
#include "curl/curl.h"                                                                                 
#include <iostream>                                                                                    

using namespace std;                                                                                   

int main() {                                                                                           
	CURLcode ret;
	ret = curl_global_init(CURL_GLOBAL_ALL);
	char url[1024] = "https://www.baidu.com/";
	CURL *handle = curl_easy_init();                                                                   
	curl_easy_setopt(handle, CURLOPT_URL, url);                                                        
	curl_easy_setopt(handle, CURLOPT_VERBOSE, 1L);                                                     
	curl_easy_setopt(handle, CURLOPT_TCP_KEEPALIVE, 1L);
	curl_easy_setopt(handle, CURLOPT_TCP_KEEPINTVL, 60L);
	curl_easy_setopt(handle, CURLOPT_TCP_KEEPIDLE, 120L);

	ret = curl_easy_perform(handle);                                                                         
	cout << "ret = " << ret << endl;

	sleep(2*60);

	ret = curl_easy_perform(handle);

	curl_easy_cleanup(handle);
	curl_global_cleanup();
	return 0;                                                                                          
}
```

After My program have exited. I check packet send by tcpdump. There are still some package send:

```
15:28:46.682240 IP 10.167.138.14.38963 > 14.215.177.38.https: Flags [F.], seq 681, ack 15793, win 331, length 0
15:28:46.692246 IP 14.215.177.38.https > 10.167.138.14.38963: Flags [.], ack 681, win 812, length 0
15:28:46.692434 IP 14.215.177.38.https > 10.167.138.14.38963: Flags [P.], seq 15793:15824, ack 681, win 812, length 31
15:28:46.692446 IP 10.167.138.14.38963 > 14.215.177.38.https: Flags [R], seq 4129804425, win 0, length 0
15:28:46.692452 IP 14.215.177.38.https > 10.167.138.14.38963: Flags [F.], seq 15824, ack 681, win 812, length 0
15:28:46.692457 IP 10.167.138.14.38963 > 14.215.177.38.https: Flags [R], seq 4129804425, win 0, length 0
15:28:46.692784 IP 14.215.177.38.https > 10.167.138.14.38963: Flags [.], ack 682, win 812, length 0
15:28:46.692791 IP 10.167.138.14.38963 > 14.215.177.38.https: Flags [R], seq 4129804426, win 0, length 0
15:28:46.848554 IP 10.167.138.14.38525 > 14.215.177.38.https: Flags [FP.], seq 725:756, ack 19647, win 316, length 31
15:28:47.264558 IP 10.167.138.14.38525 > 14.215.177.38.https: Flags [FP.], seq 725:756, ack 19647, win 316, length 31
15:28:48.096553 IP 10.167.138.14.38525 > 14.215.177.38.https: Flags [FP.], seq 725:756, ack 19647, win 316, length 31
15:28:49.764562 IP 10.167.138.14.38525 > 14.215.177.38.https: Flags [FP.], seq 725:756, ack 19647, win 316, length 31
15:28:53.104557 IP 10.167.138.14.38525 > 14.215.177.38.https: Flags [FP.], seq 725:756, ack 19647, win 316, length 31
15:28:59.776558 IP 10.167.138.14.38525 > 14.215.177.38.https: Flags [FP.], seq 725:756, ack 19647, win 316, length 31
15:29:13.120559 IP 10.167.138.14.38525 > 14.215.177.38.https: Flags [FP.], seq 725:756, ack 19647, win 316, length 31
15:29:39.808559 IP 10.167.138.14.38525 > 14.215.177.38.https: Flags [FP.], seq 725:756, ack 19647, win 316, length 31
```

And I check fd with lsof command:

```
lsof -i | grep '14.215.177.38'
```

Nothing output.

### I expected the following

I expect after my program exit, and the fd destroyed, no packet will be sent any more.

### curl/libcurl version

curl version 7.54.0

### operating system

Redhat.

**Comment by bagder** [comment]
When your program has exited, libcurl is completely dead and can no longer responsible for what's going on. If those packets can't be explained, I don't see how its curl's responsibility since it no longer runs...

It looks like resent FIN packets to me, which I presume can happen if the other side doesn't ACK them properly.

**Comment by g10guang** [comment]
I have switched url to `https://www.taobao.com/ `. No any packet sent after my libcurl program exit.

Rediculous.🙄

**Comment by g10guang** [comment]
@bagder My point is program have exited and no fd any more. Why does kernel keeping send packet?

**Comment by bagder** [comment]
> Why does kernel keeping send packet?

Because the peer doesn't ack them?

**Comment by g10guang** [comment]
Maybe the server does not follow the conventional tcp finish rule.

**Comment by bagder** [comment]
Perhaps. And since curl was already closed and gone, it can't be curl's bug. Closing this issue.
