### ISSUE TITLE
trace mode does not seem to trace the DoH query process

### ISSUE THREAD

**Issue by troyengel** [curl/curl#22848]
### I did this

Hi team, haven't filed a cURL bug since like the 90s, dusting off the old account. :) My missions was to try and figure out, due to insufficient upstream docs, how to use the Gcore public DNS DoH services. Long story short, this is the successful test cmdline and it *only* supports WIRE protocol format:

```
curl --trace-ascii log.txt --doh-url https://gcoredns.com/dns-query https://example.com
```

The log.txt, however, only has this which was of no use initially when it was failing at my guesses as to their setup:

```
*   Trying [2606:4700:10::ac42:93f3]:443...
* Host example.com:443 was resolved.
* IPv6: 2606:4700:10::ac42:93f3, 2606:4700:10::6814:179a
* IPv4: 172.66.147.243, 104.20.23.154
* ALPN: curl offers h2,http/1.1
=> Send SSL data, 5 bytes (0x5)
```

...so we see the "Trying ..." target site IP *before* the DNS log, and the DNS log is simply "was resolved". In this manner, cURL debug tracing did not solve my problem, but could have in my wee opinion.

### I expected the following

I was expecting a basic (basic!) trace of the DoH attempted connection; I resorted to running tcpdump in another window - after documenting the Gcore IPs - to watch curl making the DoH connection:

```
06:05:58.580219 IP6 ahti.35920 > 2a03:90c0:9992::1.https: Flags [.], ack 1, win 64, options [nop,nop,TS val 62419786 ecr 3309300450], length 0
06:05:58.582671 IP6 ahti.35920 > 2a03:90c0:9992::1.https: Flags [P.], seq 1:1573, ack 1, win 64, options [nop,nop,TS val 62419788 ecr 3309300450], length 1572
06:05:58.739922 IP6 2a03:90c0:9992::1.https > ahti.35920: Flags [.], ack 1573, win 8, options [nop,nop,TS val 3309300605 ecr 62419788], length 0
06:05:58.739923 IP6 2a03:90c0:9992::1.https > ahti.35920: Flags [P.], seq 1:2729, ack 1573, win 8, options [nop,nop,TS val 3309300606 ecr 62419788], length 2728
```

(`ahti` it the local laptop name, `2a03:90c0:9992::1` is one of the gcoredns.com endpoints)

My expectation here was to have to most basic trace of the DoH query in the cURL logging output, as DoH was specifically what I was trying to trace for in the situation.

### curl/libcurl version

```
$ pacman -Q curl
curl 8.22.0-1

$ curl -V
curl 8.22.0 (x86_64-pc-linux-gnu) libcurl/8.22.0 OpenSSL/3.6.4 zlib/1.3.2 brotli/1.2.0 zstd/1.5.7 libidn2/2.3.8 libpsl/0.21.5 libssh2/1.11.1 nghttp2/1.70.0 ngtcp2/1.25.0 nghttp3/1.18.0 mit-krb5/1.22.2
Release-Date: 2026-09-02
Protocols: dict file ftp ftps gopher gophers http https imap imaps ipfs ipns mqtt mqtts pop3 pop3s rtsp scp sftp smtp smtps telnet tftp ws wss
Features: alt-svc AsynchDNS brotli GSS-API HSTS HTTP2 HTTP3 HTTPS-proxy IDN IPv6 Kerberos Largefile libz PSL SPNEGO SSL threadsafe UnixSockets zstd
```

### operating system

Arch Linux, x86_64

**Comment by bagder** [comment]
You might want  `--trace-config DoH`

**Comment by troyengel** [comment]
Thank you! Gets me closer to going... huh. :) By that, what I see is an error about a non-compliant DoH query, which I know happens if you try this DoH service using GET `?name=example.com&type=A`, however it works with the `?dns=<base64 wire packet>` as well as the POST method with a wire packet. I'm trying to correlate that to the trace log snippets:

(abbreviated)
```
0000: GET /dns-query HTTP/2
0017: Host: gcoredns.com
002b: User-Agent: curl/8.22.0
0044: Accept: */*
0051: 
* Request completely sent off
...
0000: HTTP/2 400 
0000: content-type: text/plain; charset=utf-8
0000: content-length: 23
0000: referrer-policy: no-referrer
0000: x-content-type-options: nosniff
0000: strict-transport-security: max-age=31536000
0000: 
0000: DoH non-compliant query
```
->
```
=> Send SSL data, 5 bytes (0x5)
0000: .....
=> Send SSL data, 1 bytes (0x1)
0000: .
<= Recv data, 0 bytes (0x0)
* Connection #0 to host gcoredns.com:443 left intact
*   Trying [2606:4700:10::6814:179a]:443...
```

...is curl falling back to the system DNS resolver when the DoH returns the 400? I'm stuck puzzling out what happened in that last instant. Where'd curl get that `2606:470...` IP from?  (it's example.com)

**Comment by bagder** [comment]
When you ask curl to use a DoH server for name resolving, and you provide a *name* that identifies that server, clearly curl needs to resolve that hostname first without DoH so that it can contact the DoH server? That's what curl does and then it learns than your DoH server has IPv6 addresses to try.

If you rather avoid that, you need to tell curl what IP to use for the hostname of your DoH server, like with `--resolve`.

> 0000: GET /dns-query HTTP/2

Really? When I try your command line I see curl sending POST requests to the DoH server - as we never implemented DoH using GET...

**Comment by troyengel** [comment]
> curl needs to resolve that hostname first without DoH so that it can contact the DoH server

Yes sir that part was not in question, because what I was experiencing *yesterday* was different than what's happening now (the next morning). It was specifically about the IP lookup of example.com via DoH and not about resolving the DoH server itself. Apologies if I didn't make that clear, it's about example.com's lookup.

> Really? When I try your command line I see curl sending POST requests

...and I do too now, but I swear up and down I did not pull that log out of thin air or these DoH errors I was getting; I see the POST requests working as intended. I cannot explain it, but I had this GET stanza in there and it was even failing when I attempted `--doh-url https://dns.quad9.net/dns-query` which really confused me. Those log lines above are a cut & paste of what was happening, but now isn't.

I have since overwritten that test log.txt so don't have it from yesterday, did not think to keep unique copies of the debug chatter.. I'll close this as I'm just as confused today as I was yesterday as to why I was getting initial failures, then GET failures after adding the trace-config but do not get them today.

**Comment by troyengel** [comment]
I believe I've figured out my stupidity (or at least, I can make it happen) `-doh-relay` (single dash instead of `--`) is silently accepted as a `-d data` value which causes curl to look up the DoH relay as if it were the target site. Interestingly, this is the only long form option beginning with a 'd' which accepts a URL as the parameter, making it the only possible silent failure by mistake (`-doh-relay` vs `--doh-relay`).
