### ISSUE TITLE
403 response from a GET after libcurl version 7.80.0

### ISSUE THREAD

**Issue by gabrieljscunha** [curl/curl#11034]
### I did this

Fails response from a GET with a WSDL URL after libcurl version 7.80.0:

```
c:\Program Files\curl-7.80.0\bin>curl -v --insecure --capath "c:\Program Files\curl-7.80.0\bin" --cacert unimed_ca.pem --cert unimed_cert.pem --pass [PASSWORD] --key unimed_key.pem  https://wsnfse.vitoria.es.gov.br/producao/NotaFiscalService.asmx?WSDL
*   Trying 45.167.16.162:443...
* Connected to wsnfse.vitoria.es.gov.br (45.167.16.162) port 443 (#0)
* ALPN, offering http/1.1
* TLSv1.3 (OUT), TLS handshake, Client hello (1):
* TLSv1.3 (IN), TLS handshake, Server hello (2):
* TLSv1.2 (IN), TLS handshake, Certificate (11):
* TLSv1.2 (IN), TLS handshake, Server key exchange (12):
* TLSv1.2 (IN), TLS handshake, Server finished (14):
* TLSv1.2 (OUT), TLS handshake, Client key exchange (16):
* TLSv1.2 (OUT), TLS change cipher, Change cipher spec (1):
* TLSv1.2 (OUT), TLS handshake, Finished (20):
* TLSv1.2 (IN), TLS handshake, Finished (20):
* SSL connection using TLSv1.2 / ECDHE-RSA-AES256-GCM-SHA384
* ALPN, server accepted to use http/1.1
* Server certificate:
*  subject: CN=*.vitoria.es.gov.br
*  start date: May 31 00:00:00 2022 GMT
*  expire date: Jun 30 23:59:59 2023 GMT
*  issuer: C=GB; ST=Greater Manchester; L=Salford; O=Sectigo Limited; CN=Sectigo RSA Domain Validation Secure Server CA
*  SSL certificate verify result: unable to get local issuer certificate (20), continuing anyway.
> GET /producao/NotaFiscalService.asmx?WSDL HTTP/1.1
> Host: wsnfse.vitoria.es.gov.br
> User-Agent: curl/7.80.0
> Accept: */*
>
* TLSv1.2 (IN), TLS handshake, Hello request (0):
* TLSv1.2 (OUT), TLS handshake, Client hello (1):
* TLSv1.2 (IN), TLS handshake, Server hello (2):
* TLSv1.2 (IN), TLS handshake, Certificate (11):
* TLSv1.2 (IN), TLS handshake, Server key exchange (12):
* TLSv1.2 (IN), TLS handshake, Request CERT (13):
* TLSv1.2 (IN), TLS handshake, Server finished (14):
* TLSv1.2 (OUT), TLS handshake, Certificate (11):
* TLSv1.2 (OUT), TLS handshake, Client key exchange (16):
* TLSv1.2 (OUT), TLS handshake, CERT verify (15):
* TLSv1.2 (OUT), TLS change cipher, Change cipher spec (1):
* TLSv1.2 (OUT), TLS handshake, Finished (20):
* TLSv1.2 (IN), TLS handshake, Finished (20):
* old SSL session ID is stale, removing
* Mark bundle as not supporting multiuse
< HTTP/1.1 403 Forbidden
< Content-Type: text/html
< Server: Microsoft-IIS/10.0
< X-Powered-By: ASP.NET
< Date: Wed, 26 Apr 2023 17:56:06 GMT
< Content-Length: 1233
<
<!DOCTYPE html PUBLIC "-//W3C//DTD XHTML 1.0 Strict//EN" "http://www.w3.org/TR/xhtml1/DTD/xhtml1-strict.dtd">
<html xmlns="http://www.w3.org/1999/xhtml">
<head>
<meta http-equiv="Content-Type" content="text/html; charset=iso-8859-1"/>
<title>403 - Forbidden: Access is denied.</title>
<style type="text/css">
<!--
body{margin:0;font-size:.7em;font-family:Verdana, Arial, Helvetica, sans-serif;background:#EEEEEE;}
fieldset{padding:0 15px 10px 15px;}
h1{font-size:2.4em;margin:0;color:#FFF;}
h2{font-size:1.7em;margin:0;color:#CC0000;}
h3{font-size:1.2em;margin:10px 0 0 0;color:#000000;}
#header{width:96%;margin:0 0 0 0;padding:6px 2% 6px 2%;font-family:"trebuchet MS", Verdana, sans-serif;color:#FFF;
background-color:#555555;}
#content{margin:0 0 0 2%;position:relative;}
.content-container{background:#FFF;width:96%;margin-top:8px;padding:10px;position:relative;}
-->
</style>
</head>
<body>
<div id="header"><h1>Server Error</h1></div>
<div id="content">
 <div class="content-container"><fieldset>
  <h2>403 - Forbidden: Access is denied.</h2>
  <h3>You do not have permission to view this directory or page using the credentials that you supplied.</h3>
 </fieldset></div>
</div>
</body>
</html>
* Connection #0 to host wsnfse.vitoria.es.gov.br left intact

```
### I expected the following

I expect 200 OK and data. As in the output below, using libcurl version 7.79.1 and earlier:

```
c:\Program Files\curl-7.79.1\bin>curl -v --insecure --capath "c:\Program Files\curl-7.79.1\bin" --cacert unimed_ca.pem --cert unimed_cert.pem --pass [PASSWORD] --key unimed_key.pem  https://wsnfse.vitoria.es.gov.br/producao/NotaFiscalService.asmx?WSDL
*   Trying 45.167.16.162:443...
* Connected to wsnfse.vitoria.es.gov.br (45.167.16.162) port 443 (#0)
* ALPN, offering http/1.1
* successfully set certificate verify locations:
*  CAfile: unimed_ca.pem
*  CApath: c:\Program Files\curl-7.79.1\bin
* TLSv1.3 (OUT), TLS handshake, Client hello (1):
* TLSv1.3 (IN), TLS handshake, Server hello (2):
* TLSv1.2 (IN), TLS handshake, Certificate (11):
* TLSv1.2 (IN), TLS handshake, Server key exchange (12):
* TLSv1.2 (IN), TLS handshake, Server finished (14):
* TLSv1.2 (OUT), TLS handshake, Client key exchange (16):
* TLSv1.2 (OUT), TLS change cipher, Change cipher spec (1):
* TLSv1.2 (OUT), TLS handshake, Finished (20):
* TLSv1.2 (IN), TLS handshake, Finished (20):
* SSL connection using TLSv1.2 / ECDHE-RSA-AES256-GCM-SHA384
* ALPN, server accepted to use http/1.1
* Server certificate:
*  subject: CN=*.vitoria.es.gov.br
*  start date: May 31 00:00:00 2022 GMT
*  expire date: Jun 30 23:59:59 2023 GMT
*  issuer: C=GB; ST=Greater Manchester; L=Salford; O=Sectigo Limited; CN=Sectigo RSA Domain Validation Secure Server CA
*  SSL certificate verify result: unable to get local issuer certificate (20), continuing anyway.
> GET /producao/NotaFiscalService.asmx?WSDL HTTP/1.1
> Host: wsnfse.vitoria.es.gov.br
> User-Agent: curl/7.79.1
> Accept: */*
>
* TLSv1.2 (IN), TLS handshake, Hello request (0):
* TLSv1.2 (OUT), TLS handshake, Client hello (1):
* TLSv1.2 (IN), TLS handshake, Server hello (2):
* TLSv1.2 (IN), TLS handshake, Certificate (11):
* TLSv1.2 (IN), TLS handshake, Server key exchange (12):
* TLSv1.2 (IN), TLS handshake, Request CERT (13):
* TLSv1.2 (IN), TLS handshake, Server finished (14):
* TLSv1.2 (OUT), TLS handshake, Certificate (11):
* TLSv1.2 (OUT), TLS handshake, Client key exchange (16):
* TLSv1.2 (OUT), TLS handshake, CERT verify (15):
* TLSv1.2 (OUT), TLS change cipher, Change cipher spec (1):
* TLSv1.2 (OUT), TLS handshake, Finished (20):
* TLSv1.2 (IN), TLS handshake, Finished (20):
* old SSL session ID is stale, removing
* Mark bundle as not supporting multiuse
< HTTP/1.1 200 OK
< Cache-Control: private, max-age=0
< Content-Type: text/xml; charset=utf-8
< Server: Microsoft-IIS/10.0
< X-AspNet-Version: 4.0.30319
< X-Powered-By: ASP.NET
< Date: Wed, 26 Apr 2023 17:50:20 GMT
< Content-Length: 18651

```
However I got 403 Forbidden.

Would this behavior be expected after this release? Do we have to change any parameters?

### curl/libcurl version

curl 7.80.0 (x86_64-pc-win32) libcurl/7.80.0 OpenSSL/1.1.1t zlib/1.2.13 libssh2/1.10.0
Release-Date: 2021-11-10
Protocols: dict file ftp ftps gopher gophers http https imap imaps ldap ldaps mqtt pop3 pop3s rtsp scp sftp smb smbs smtp smtps telnet tftp
Features: AsynchDNS HSTS HTTPS-proxy IPv6 Largefile NTLM SSL UnixSockets alt-svc libz

### operating system

Microsoft Windows [Version 10.0.19044.2846]

**Comment by dfandrich** [comment]
Are you implying that it works with a different curl version?

**Comment by gabrieljscunha** [comment]
Right, in versions older than 7.80.0 of curl it works

**Comment by bagder** [comment]
The server decides how to respond and it is not easy to know why it does things for different clients. Have you tried changing the user-agent to the old version number one or even to something completely different to see if that is what the server bounces on?

**Comment by bagder** [comment]
A different response code from the server is not a bug in curl.

**Comment by gabrieljscunha** [comment]
I didn't try to change the user-agent, I kept it uninformed in both cases.

Right, but my biggest doubt is why even without changing the options of the curl request, from version 7.80.0 it starts to present this return code from the server... Is there any behavior that was changed from this version? Can I perform some kind of additional configuration? Do you have an idea of anything I can do for this situation?

**Comment by bagder** [comment]
> it starts to present this return code from the server

I think you should look at it this way:

For some reason, the server decides to return a 403 for one request where it otherwise returns a 200. One of the few *obvious* differences between those two requests is the `User-Agent:` request header.

> Is there any behavior that was changed from this version.

No, but the default `User-Agent` header changed due to the new version.

> Can I perform some kind of additional configuration?

You can try changing the `User-Agent`.

Again: this is not curl acting weird. This is the server explicitly deciding to return a 403 due to something that we can't easily pinpoint without trying different things and see how it reacts. This is not a curl issue.

**Comment by gabrieljscunha** [comment]
Okay, thanks for your feedback.

In this situation I am only a client, not access to make changes to the server.

> You can try changing the User-Agent.*

I changed the User-Agent to the same as in version **7.79.1**, but I got the same behavior, the server returned a 403 for my request:

```
c:\Program Files\curl-7.79.1\bin>curl -v --insecure -A "curl/7.79.1" --capath "c:\Program Files\curl-7.79.1\bin" --cacert unimed_ca.pem --cert unimed_cert.pem --pass [PASSWORD] --key unimed_key.pem  https://wsnfse.vitoria.es.gov.br/producao/NotaFiscalService.asmx?WSDL
*   Trying 45.167.16.162:443...
* Connected to wsnfse.vitoria.es.gov.br (45.167.16.162) port 443 (#0)
* ALPN, offering http/1.1
* TLSv1.3 (OUT), TLS handshake, Client hello (1):
* TLSv1.3 (IN), TLS handshake, Server hello (2):
* TLSv1.2 (IN), TLS handshake, Certificate (11):
* TLSv1.2 (IN), TLS handshake, Server key exchange (12):
* TLSv1.2 (IN), TLS handshake, Server finished (14):
* TLSv1.2 (OUT), TLS handshake, Client key exchange (16):
* TLSv1.2 (OUT), TLS change cipher, Change cipher spec (1):
* TLSv1.2 (OUT), TLS handshake, Finished (20):
* TLSv1.2 (IN), TLS handshake, Finished (20):
* SSL connection using TLSv1.2 / ECDHE-RSA-AES256-GCM-SHA384
* ALPN, server accepted to use http/1.1
* Server certificate:
*  subject: CN=*.vitoria.es.gov.br
*  start date: May 31 00:00:00 2022 GMT
*  expire date: Jun 30 23:59:59 2023 GMT
*  issuer: C=GB; ST=Greater Manchester; L=Salford; O=Sectigo Limited; CN=Sectigo RSA Domain Validation Secure Server CA
*  SSL certificate verify result: unable to get local issuer certificate (20), continuing anyway.
> GET /producao/NotaFiscalService.asmx?WSDL HTTP/1.1
> Host: wsnfse.vitoria.es.gov.br
> User-Agent: curl/7.79.1
> Accept: */*
>
* TLSv1.2 (IN), TLS handshake, Hello request (0):
* TLSv1.2 (OUT), TLS handshake, Client hello (1):
* TLSv1.2 (IN), TLS handshake, Server hello (2):
* TLSv1.2 (IN), TLS handshake, Certificate (11):
* TLSv1.2 (IN), TLS handshake, Server key exchange (12):
* TLSv1.2 (IN), TLS handshake, Request CERT (13):
* TLSv1.2 (IN), TLS handshake, Server finished (14):
* TLSv1.2 (OUT), TLS handshake, Certificate (11):
* TLSv1.2 (OUT), TLS handshake, Client key exchange (16):
* TLSv1.2 (OUT), TLS handshake, CERT verify (15):
* TLSv1.2 (OUT), TLS change cipher, Change cipher spec (1):
* TLSv1.2 (OUT), TLS handshake, Finished (20):
* TLSv1.2 (IN), TLS handshake, Finished (20):
* old SSL session ID is stale, removing
* Mark bundle as not supporting multiuse
< HTTP/1.1 403 Forbidden
< Content-Type: text/html
< Server: Microsoft-IIS/10.0
< X-Powered-By: ASP.NET
< Date: Thu, 27 Apr 2023 12:29:28 GMT
< Content-Length: 1233
<
<!DOCTYPE html PUBLIC "-//W3C//DTD XHTML 1.0 Strict//EN" "http://www.w3.org/TR/xhtml1/DTD/xhtml1-strict.dtd">
<html xmlns="http://www.w3.org/1999/xhtml">
<head>
<meta http-equiv="Content-Type" content="text/html; charset=iso-8859-1"/>
<title>403 - Forbidden: Access is denied.</title>
<style type="text/css">
<!--
```
In addition to the **User-Agent**, would there be any other recommendations I can make to identify this change in server response behavior between curl versions?

PS: I'm already enabling verbose, would you have any other options for us to have more details in the logs?

**Comment by bagder** [comment]
I can't spot anything that can explain the difference. It looks like it could be a regression in curl for this (I suspected something around client cert auth). I took a look at TLS changes between these two versions but I could not find anything that seemed like a candidate.

If this is problem persists in the most recent curl release, it might be worth considering doing a bisect to pinpoint exactly what change that introduced this problem.

**Comment by jay** [comment]
https://github.com/curl/curl/wiki/how-to-git-bisect

**Comment by gabrieljscunha** [comment]
Thank you for the informations @bagder . I had already tested it in the most recent versions, and it kept the same behavior.

With @jay  recommendation, I ran **git bisect** between the bad commit (**curl-7_80_0**) and the good one (**curl-7_79_1**) and managed to identify the change that caused the problem:

```
83393b1a3613ec4e99502ff01ac936994841ced9 is the first bad commit
commit 83393b1a3613ec4e99502ff01ac936994841ced9
Author: Daniel Stenberg <daniel@haxx.se>
Date:   Fri Oct 22 12:34:34 2021 +0200

    openssl: if verifypeer is not requested, skip the CA loading
    It was previously done mostly to show a match/non-match in the verbose
    output even when verification was not asked for. This change skips the
    loading of the CA certs unless verifypeer is set to save memory and CPU.

    Closes #7892	
  ```
  
In this commit, it is skipping the AC load if verification is not requested. Apparently this is the cause, so I would like to check the best way to resolve this issue.

**Comment by jay** [comment]
> With @jay recommendation, I ran **git bisect** between the bad commit (**curl-7_80_0**) and the good one (**curl-7_79_1**) and managed to identify the change that caused the problem:
> 
> ```
> 83393b1a3613ec4e99502ff01ac936994841ced9 is the first bad commit
> ```

I'm at a loss as to how that commit could cause the issue. Is it possible it's an intermittent issue and if you run the command multiple times you get different results? What happens if you don't use `--insecure` and let curl load the certificate bundle/location and verify the server?

**Comment by jay** [comment]
> --cacert unimed_ca.pem --cert unimed_cert.pem

I took another look at your command and it seems you are attempting to load the CA for your user certificate. Maybe that is why. --cacert is meant for server CA certificates not client CA certificates. Since you have a split user certificate and key, you could try appending the CA to the user certificate directly, like this
~~~
type unimed_cert.pem unimed_ca.pem > test.pem
~~~
then `--cert test.pem`

Internally libcurl uses [SSL_CTX_use_certificate_chain_file](https://www.openssl.org/docs/man3.0/man3/SSL_CTX_use_certificate_chain_file.html) to load the key which expects a chain of certificates, so this is the format it expects

_"SSL_CTX_use_certificate_chain_file() loads a certificate chain from file into ctx. The certificates must be in PEM format and must be sorted starting with the subject's certificate (actual client or server certificate), followed by intermediate CA certificates if applicable, and ending at the highest level (root) CA. SSL_use_certificate_chain_file() is similar except it loads the certificate chain into ssl."_

Though I'll guess in practice some of those certs are missing CAs so as a workaround it might search for already loaded CAs, which is why curl appears to work for you when you load the CA with --cacert.

**Comment by gabrieljscunha** [comment]
Thanks for the info, sorry for the delay in getting back to you.

> I'm at a loss as to how that commit could cause the issue. Is it possible it's an intermittent issue and if you run the command multiple times you get different results? What happens if you don't use --insecure and let curl load the certificate bundle/location and verify the server?

We were able to reproduce on every attempt, even without using --insecure (we don't have free access to the production server, where we don't use --insecure, it would be an external client environment)

> type unimed_cert.pem unimed_ca.pem > test.pem
then --cert test.pem

We performed the requested procedure, appending the requested certificates, however the problem persists in our application even not using --insecure

When we do not use --insecure, we request verifypeer, according to the code snippet below:

```
         if (!bSSLInsecure)
         {
             curl_easy_setopt(curl, CURLOPT_SSL_VERIFYPEER, 1L);
             curl_easy_setopt(curl, CURLOPT_SSL_VERIFYHOST, 2L);
         }
```
With appending certificates the problem occurred in both versions (before and above 7.80.0)

In view of this, we kindly ask you to check or if we could take any further steps to resolve this issue in the best possible way.

**Comment by gabrieljscunha** [comment]
Do you have any idea what it could be, could you help us please?

**Comment by jay** [comment]
You'll have to use Wireshark and [SSLKEYLOGFILE](https://everything.curl.dev/usingcurl/tls/sslkeylogfile) to investigate any difference in how the client certificate is sent.

**Comment by jay** [comment]
@gabrieljscunha do you have an update on this issue?

**Comment by gabrieljscunha** [comment]
Yes @jay , we were finalizing some details of the investigation.

Using Wireshark and SSLKEYLOGFILE we didn't find a significant difference in how the client certificate is sent. The only significant differences were as follows:

```
# Difference in **Stream index** and **GMT Unix Time** fields

- Version 7.83.1
"1027","45.499598","192.168.0.4","45.167.16.162","TLSv1.2","571","Client Hello"
Transmission Control Protocol, Src Port: 61466, Dst Port: 443, Seq: 1, Ack: 1, Len: 517
    Source Port: 61466
    Destination Port: 443
    [**Stream index**: 19]
    [Conversation completeness: Complete, WITH_DATA (31)]
    [TCP Segment Len: 517]
    Sequence Number: 1    (relative sequence number)
    Sequence Number (raw): 2472643767
    [Next Sequence Number: 518    (relative sequence number)]
    Acknowledgment Number: 1    (relative ack number)
    Acknowledgment number (raw): 2822960666
    0101 .... = Header Length: 20 bytes (5)
    Flags: 0x018 (PSH, ACK)
    Window: 513
    [Calculated window size: 131328]
    [Window size scaling factor: 256]
    Checksum: 0x18b3 [unverified]
    [Checksum Status: Unverified]
    Urgent Pointer: 0
    [Timestamps]
    [SEQ/ACK analysis]
    TCP payload (517 bytes)
	
Transport Layer Security
    TLSv1.2 Record Layer: Handshake Protocol: Client Hello
        Content Type: Handshake (22)
        Version: TLS 1.0 (0x0301)
        Length: 512
        Handshake Protocol: Client Hello
            Handshake Type: Client Hello (1)
            Length: 508
            Version: TLS 1.2 (0x0303)
            Random: 4d7c0515b6e52dac140f712a3833687a384e6d5d7275dbfb1be5fb734513f7f6
                **GMT Unix Time**: Mar 12, 2011 20:43:17.000000000 Hora oficial do Brasil
                Random Bytes: b6e52dac140f712a3833687a384e6d5d7275dbfb1be5fb734513f7f6
            Session ID Length: 32
            Session ID: b7047ca76768a4a93d5aa80469c8ba90a5ad6fa6c0b56d9a2331cc58e2df722c
            Cipher Suites Length: 62
            Cipher Suites (31 suites)
            Compression Methods Length: 1
            Compression Methods (1 method)
            Extensions Length: 373
            Extension: server_name (len=29)
				
- Version 7.74.0
"2207","55.334607","192.168.0.4","45.167.16.162","TLSv1.2","571","Client Hello"
Transmission Control Protocol, Src Port: 50897, Dst Port: 443, Seq: 1, Ack: 1, Len: 517
    Source Port: 50897
    Destination Port: 443
    [**Stream index**: 56]
    [Conversation completeness: Complete, WITH_DATA (31)]
    [TCP Segment Len: 517]
    Sequence Number: 1    (relative sequence number)
    Sequence Number (raw): 2313381848
    [Next Sequence Number: 518    (relative sequence number)]
    Acknowledgment Number: 1    (relative ack number)
    Acknowledgment number (raw): 637485206
    0101 .... = Header Length: 20 bytes (5)
    Flags: 0x018 (PSH, ACK)
    Window: 513
    [Calculated window size: 131328]
    [Window size scaling factor: 256]
    Checksum: 0x9fad [unverified]
    [Checksum Status: Unverified]
    Urgent Pointer: 0
    [Timestamps]
    [SEQ/ACK analysis]
    TCP payload (517 bytes)

Transport Layer Security
    TLSv1.2 Record Layer: Handshake Protocol: Client Hello
        Content Type: Handshake (22)
        Version: TLS 1.0 (0x0301)
        Length: 512
        Handshake Protocol: Client Hello
            Handshake Type: Client Hello (1)
            Length: 508
            Version: TLS 1.2 (0x0303)
			Random: 8fe9d6ebd0eada8401e4af30f96dcdca423114045c86e49bf6feddadd84dfdd3
				**GMT Unix Time**: Jul  6, 2046 02:13:15.000000000 Hora oficial do Brasil
				Random Bytes: d0eada8401e4af30f96dcdca423114045c86e49bf6feddadd84dfdd3
            Session ID Length: 32
            Session ID: 526ef1f438415efbaf680860123ffe6a23f595cc032528e47b02c936f691565e
            Cipher Suites Length: 62
            Cipher Suites (31 suites)
            Compression Methods Length: 1
            Compression Methods (1 method)
            Extensions Length: 373
            Extension: server_name (len=29)


# In the GET the only relevant difference detected would be the **User-Agent**

- Version 7.83.1
"1038","45.653088","192.168.0.4","45.167.16.162","HTTP","207","GET /producao/NotaFiscalService.asmx?WSDL HTTP/1.1 "
Transmission Control Protocol, Src Port: 61466, Dst Port: 443, Seq: 676, Ack: 3709, Len: 153
    Source Port: 61466
    Destination Port: 443
    [Stream index: 19]
    [Conversation completeness: Complete, WITH_DATA (31)]
    [TCP Segment Len: 153]
    Sequence Number: 676    (relative sequence number)
    Sequence Number (raw): 2472644442
    [Next Sequence Number: 829    (relative sequence number)]
    Acknowledgment Number: 3709    (relative ack number)
    Acknowledgment number (raw): 2822964374
    0101 .... = Header Length: 20 bytes (5)
    Flags: 0x018 (PSH, ACK)
    Window: 513
    [Calculated window size: 131328]
    [Window size scaling factor: 256]
    Checksum: 0x1efe [unverified]
    [Checksum Status: Unverified]
    Urgent Pointer: 0
    [Timestamps]
    [SEQ/ACK analysis]
    TCP payload (153 bytes)

Transport Layer Security
    TLSv1.2 Record Layer: Application Data Protocol: Hypertext Transfer Protocol
        Content Type: Application Data (23)
        Version: TLS 1.2 (0x0303)
        Length: 148
        Encrypted Application Data: 1457aa78267f0cba90e9a9f0044f3fd24da24dba097fbc1610bfb8f597ae7ea37828e8e3…
        [Application Data Protocol: Hypertext Transfer Protocol]

Hypertext Transfer Protocol
    GET /producao/NotaFiscalService.asmx?WSDL HTTP/1.1\r\n
        [Expert Info (Chat/Sequence): GET /producao/NotaFiscalService.asmx?WSDL HTTP/1.1\r\n]
            [GET /producao/NotaFiscalService.asmx?WSDL HTTP/1.1\r\n]
            [Severity level: Chat]
            [Group: Sequence]
        Request Method: GET
        Request URI: /producao/NotaFiscalService.asmx?WSDL
            Request URI Path: /producao/NotaFiscalService.asmx
            Request URI Query: WSDL
                Request URI Query Parameter: WSDL
        Request Version: HTTP/1.1
    Host: wsnfse.vitoria.es.gov.br\r\n
    **User-Agent**: curl/7.83.1\r\n
    Accept: */*\r\n
    \r\n
    [Full request URI: https://wsnfse.vitoria.es.gov.br/producao/NotaFiscalService.asmx?WSDL]
    [HTTP request 1/1]
    [Response in frame: 1052]
	
In SSLKEYLOGFILE:
dissect_ssl enter frame #2123 (first time)
packet_from_server: is from server - FALSE
  conversation = 000001989787F2C0, ssl_session = 0000019897880860
  record: offset = 0, reported_length_remaining = 153
dissect_ssl3_record: content_type 23 Application Data
decrypt_ssl3_record: app_data len 148, ssl state 0x1BF
packet_from_server: is from server - FALSE
decrypt_ssl3_record: using client decoder
ssl_decrypt_record ciphertext len 148
Ciphertext[148]:
| 17 f2 2a b1 84 75 ea 14 01 f6 71 41 61 7a 5b e1 |..*..u....qAaz[.|
| 75 13 ed 24 e7 6b 5e df 2a ba 04 f7 2f 09 cc 3b |u..$.k^.*.../..;|
| ea ad 10 a0 cc e1 8e 3e f5 a4 3f 07 14 b5 01 19 |.......>..?.....|
| 04 10 d0 fa e5 f6 9c b2 98 c1 65 65 15 a9 02 13 |..........ee....|
| 55 96 04 7d ce da a1 73 41 85 6a 01 a3 04 d1 15 |U..}...sA.j.....|
| 6b ce ac 7b c2 85 45 f5 bb ce 21 6f 97 d3 6a 25 |k..{..E...!o..j%|
| 1d b7 b2 ab 0e 07 19 97 7a c7 45 78 cc 17 60 a4 |........z.Ex..`.|
| 1d e1 3d 4e 4e d5 35 e8 7f 62 90 b0 9d 61 17 e5 |..=NN.5..b...a..|
| 2f b7 03 fe 59 5a ce 9b 9f d2 9f 7b e2 b6 2f d5 |/...YZ.....{../.|
| 39 16 c6 c3                                     |9...            |
ssl_decrypt_record: allocating 180 bytes for decrypt data (old len 72)
nonce[12]:
| 7c 33 be 28 17 f2 2a b1 84 75 ea 14             ||3.(..*..u..    |
AAD[13]:
| 00 00 00 00 00 00 00 01 17 03 03 00 7c          |............|   |
auth_tag(OK)[16]:
| 59 5a ce 9b 9f d2 9f 7b e2 b6 2f d5 39 16 c6 c3 |YZ.....{../.9...|
Plaintext[124]:
| 47 45 54 20 2f 70 72 6f 64 75 63 61 6f 2f 4e 6f |GET /producao/No|
| 74 61 46 69 73 63 61 6c 53 65 72 76 69 63 65 2e |taFiscalService.|
| 61 73 6d 78 3f 57 53 44 4c 20 48 54 54 50 2f 31 |asmx?WSDL HTTP/1|
| 2e 31 0d 0a 48 6f 73 74 3a 20 77 73 6e 66 73 65 |.1..Host: wsnfse|
| 2e 76 69 74 6f 72 69 61 2e 65 73 2e 67 6f 76 2e |.vitoria.es.gov.|
| 62 72 0d 0a 55 73 65 72 2d 41 67 65 6e 74 3a 20 |br..User-Agent: |
| 63 75 72 6c 2f 37 2e 38 33 2e 31 0d 0a 41 63 63 |curl/7.83.1..Acc|
| 65 70 74 3a 20 2a 2f 2a 0d 0a 0d 0a             |ept: */*....    |
ssl_add_record_info stored decrypted record seq=0 nxtseq=124 flow=0000019897882C20
dissect_ssl_payload decrypted len 124
decrypted app data fragment[124]:
| 47 45 54 20 2f 70 72 6f 64 75 63 61 6f 2f 4e 6f |GET /producao/No|
| 74 61 46 69 73 63 61 6c 53 65 72 76 69 63 65 2e |taFiscalService.|
| 61 73 6d 78 3f 57 53 44 4c 20 48 54 54 50 2f 31 |asmx?WSDL HTTP/1|
| 2e 31 0d 0a 48 6f 73 74 3a 20 77 73 6e 66 73 65 |.1..Host: wsnfse|
| 2e 76 69 74 6f 72 69 61 2e 65 73 2e 67 6f 76 2e |.vitoria.es.gov.|
| 62 72 0d 0a 55 73 65 72 2d 41 67 65 6e 74 3a 20 |br..User-Agent: |
| 63 75 72 6c 2f 37 2e 38 33 2e 31 0d 0a 41 63 63 |curl/7.83.1..Acc|
| 65 70 74 3a 20 2a 2f 2a 0d 0a 0d 0a             |ept: */*....    |
process_ssl_payload: found handle 000001989100C830 (http-over-tls)
packet_from_server: is from server - FALSE	
	
- Version 7.74.0	
"2216","55.561906","192.168.0.4","45.167.16.162","HTTP","207","GET /producao/NotaFiscalService.asmx?WSDL HTTP/1.1 "
Transmission Control Protocol, Src Port: 50897, Dst Port: 443, Seq: 676, Ack: 3709, Len: 153
    Source Port: 50897
    Destination Port: 443
    [Stream index: 56]
    [Conversation completeness: Complete, WITH_DATA (31)]
    [TCP Segment Len: 153]
    Sequence Number: 676    (relative sequence number)
    Sequence Number (raw): 2313382523
    [Next Sequence Number: 829    (relative sequence number)]
    Acknowledgment Number: 3709    (relative ack number)
    Acknowledgment number (raw): 637488914
    0101 .... = Header Length: 20 bytes (5)
    Flags: 0x018 (PSH, ACK)
    Window: 513
    [Calculated window size: 131328]
    [Window size scaling factor: 256]
    Checksum: 0x6979 [unverified]
    [Checksum Status: Unverified]
    Urgent Pointer: 0
    [Timestamps]
    [SEQ/ACK analysis]
    TCP payload (153 bytes)

Transport Layer Security
    TLSv1.2 Record Layer: Application Data Protocol: Hypertext Transfer Protocol
        Content Type: Application Data (23)
        Version: TLS 1.2 (0x0303)
        Length: 148
        Encrypted Application Data: c814d7bc4270c102d6cf346a20cbfdf02bf202e3dd10347443ab22b6ea07f8e91551550a…
        [Application Data Protocol: Hypertext Transfer Protocol]

Hypertext Transfer Protocol
    GET /producao/NotaFiscalService.asmx?WSDL HTTP/1.1\r\n
        [Expert Info (Chat/Sequence): GET /producao/NotaFiscalService.asmx?WSDL HTTP/1.1\r\n]
            [GET /producao/NotaFiscalService.asmx?WSDL HTTP/1.1\r\n]
            [Severity level: Chat]
            [Group: Sequence]
        Request Method: GET
        Request URI: /producao/NotaFiscalService.asmx?WSDL
            Request URI Path: /producao/NotaFiscalService.asmx
            Request URI Query: WSDL
                Request URI Query Parameter: WSDL
        Request Version: HTTP/1.1
    Host: wsnfse.vitoria.es.gov.br\r\n
    **User-Agent**: curl/7.74.0\r\n
    Accept: */*\r\n
    \r\n
    [Full request URI: https://wsnfse.vitoria.es.gov.br/producao/NotaFiscalService.asmx?WSDL]
    [HTTP request 1/1]
    [Response in frame: 2249]
	
In SSLKEYLOGFILE:	
dissect_ssl enter frame #8746 (first time)
packet_from_server: is from server - FALSE
  conversation = 0000020FAFC79FC0, ssl_session = 0000020FAFC7D420
  record: offset = 0, reported_length_remaining = 153
dissect_ssl3_record: content_type 23 Application Data
decrypt_ssl3_record: app_data len 148, ssl state 0x1BF
packet_from_server: is from server - FALSE
decrypt_ssl3_record: using client decoder
ssl_decrypt_record ciphertext len 148
Ciphertext[148]:
| 59 f7 78 01 a6 2f aa db fc 11 08 b6 f6 02 91 fd |Y.x../..........|
| 7a 7e 13 13 95 ec 04 e8 ee ad 21 f8 e4 3a 6e b8 |z~........!..:n.|
| 8d 61 dd 05 f5 e0 db d3 09 5f f7 58 a6 50 f6 a1 |.a......._.X.P..|
| 4c cd ff 98 58 dc c3 c7 6d 86 11 c5 a8 94 b6 11 |L...X...m.......|
| 14 6c 97 b8 95 13 25 1a 4b f6 30 95 bf aa 26 c8 |.l....%.K.0...&.|
| 30 19 e0 43 84 81 59 59 43 eb f7 00 f7 c0 8c ba |0..C..YYC.......|
| f7 eb 09 08 84 91 d1 09 55 8b 18 7c be c9 fc 76 |........U..|...v|
| 88 54 e5 fd 5a 4c 30 01 02 d1 b0 4a 88 eb 10 2d |.T..ZL0....J...-|
| aa 27 e0 13 d6 11 f8 23 93 9b d5 32 4b 63 e7 7a |.'.....#...2Kc.z|
| f2 bc 61 28                                     |..a(            |
ssl_decrypt_record: allocating 180 bytes for decrypt data (old len 72)
nonce[12]:
| 97 e4 50 0e 59 f7 78 01 a6 2f aa db             |..P.Y.x../..    |
AAD[13]:
| 00 00 00 00 00 00 00 01 17 03 03 00 7c          |............|   |
auth_tag(OK)[16]:
| d6 11 f8 23 93 9b d5 32 4b 63 e7 7a f2 bc 61 28 |...#...2Kc.z..a(|
Plaintext[124]:
| 47 45 54 20 2f 70 72 6f 64 75 63 61 6f 2f 4e 6f |GET /producao/No|
| 74 61 46 69 73 63 61 6c 53 65 72 76 69 63 65 2e |taFiscalService.|
| 61 73 6d 78 3f 57 53 44 4c 20 48 54 54 50 2f 31 |asmx?WSDL HTTP/1|
| 2e 31 0d 0a 48 6f 73 74 3a 20 77 73 6e 66 73 65 |.1..Host: wsnfse|
| 2e 76 69 74 6f 72 69 61 2e 65 73 2e 67 6f 76 2e |.vitoria.es.gov.|
| 62 72 0d 0a 55 73 65 72 2d 41 67 65 6e 74 3a 20 |br..User-Agent: |
| 63 75 72 6c 2f 37 2e 37 34 2e 30 0d 0a 41 63 63 |curl/7.74.0..Acc|
| 65 70 74 3a 20 2a 2f 2a 0d 0a 0d 0a             |ept: */*....    |
ssl_add_record_info stored decrypted record seq=0 nxtseq=124 flow=0000020FAFC7F460
dissect_ssl_payload decrypted len 124
decrypted app data fragment[124]:
| 47 45 54 20 2f 70 72 6f 64 75 63 61 6f 2f 4e 6f |GET /producao/No|
| 74 61 46 69 73 63 61 6c 53 65 72 76 69 63 65 2e |taFiscalService.|
| 61 73 6d 78 3f 57 53 44 4c 20 48 54 54 50 2f 31 |asmx?WSDL HTTP/1|
| 2e 31 0d 0a 48 6f 73 74 3a 20 77 73 6e 66 73 65 |.1..Host: wsnfse|
| 2e 76 69 74 6f 72 69 61 2e 65 73 2e 67 6f 76 2e |.vitoria.es.gov.|
| 62 72 0d 0a 55 73 65 72 2d 41 67 65 6e 74 3a 20 |br..User-Agent: |
| 63 75 72 6c 2f 37 2e 37 34 2e 30 0d 0a 41 63 63 |curl/7.74.0..Acc|
| 65 70 74 3a 20 2a 2f 2a 0d 0a 0d 0a             |ept: */*....    |
process_ssl_payload: found handle 0000020FAE91D830 (http-over-tls)
packet_from_server: is from server - FALSE

			
# Difference in GET Return

- Version 7.83.1
"1052","45.862495","45.167.16.162","192.168.0.4","HTTP","1477","HTTP/1.1 403 Forbidden  (text/html)"
Transmission Control Protocol, Src Port: 443, Dst Port: 61466, Seq: 8631, Ack: 3879, Len: 1423
    Source Port: 443
    Destination Port: 61466
    [Stream index: 19]
    [Conversation completeness: Complete, WITH_DATA (31)]
    [TCP Segment Len: 1423]
    Sequence Number: 8631    (relative sequence number)
    Sequence Number (raw): 2822969296
    [Next Sequence Number: 10054    (relative sequence number)]
    Acknowledgment Number: 3879    (relative ack number)
    Acknowledgment number (raw): 2472647645
    0101 .... = Header Length: 20 bytes (5)
    Flags: 0x018 (PSH, ACK)
    Window: 18478
    [Calculated window size: 18478]
    [Window size scaling factor: 1]
    Checksum: 0x8a19 [unverified]
    [Checksum Status: Unverified]
    Urgent Pointer: 0
    [Timestamps]
    [SEQ/ACK analysis]
    TCP payload (1423 bytes)

- Version 7.74.0
"2249","55.845580","45.167.16.162","192.168.0.4","HTTP/XML","1476","HTTP/1.1 200 OK "
Transmission Control Protocol, Src Port: 443, Dst Port: 50897, Seq: 26151, Ack: 8979, Len: 1422
    Source Port: 443
    Destination Port: 50897
    [Stream index: 56]
    [Conversation completeness: Complete, WITH_DATA (31)]
    [TCP Segment Len: 1422]
    Sequence Number: 26151    (relative sequence number)
    Sequence Number (raw): 637511356
    [Next Sequence Number: 27573    (relative sequence number)]
    Acknowledgment Number: 8979    (relative ack number)
    Acknowledgment number (raw): 2313390826
    0101 .... = Header Length: 20 bytes (5)
    Flags: 0x018 (PSH, ACK)
    Window: 23578
    [Calculated window size: 23578]
    [Window size scaling factor: 1]
    Checksum: 0x7d21 [unverified]
    [Checksum Status: Unverified]
    Urgent Pointer: 0
    [Timestamps]
    [SEQ/ACK analysis]
    TCP payload (1422 bytes)
    TCP segment data (1422 bytes)
		
```

Even with this investigation we were unable to arrive at a conclusive reason. Being at the same point, in which only from version 7.80.0 this behavior change occurs.

Could you help us? Is there any information that goes unnoticed or behavior that we do not detect in this data? Would you like more evidence? Is there any other procedure we could perform?

**Comment by jay** [comment]
As I mentioned earlier the proper way to do it is put the certificates in the correct order in the client file. I tested that method with and without the revert and the same certificate data is sent in response to the server's client certificate request. Since I don't have access to the server I still get a forbidden reply. Examine your wireshark captures to see how they differ in terms of certificates. The information sent in 'Certificate' should be identical.

~~~
curld -v --insecure --cert client_with_ca_appended.crt --key client.key https://wsnfse.vitoria.es.gov.br/producao/NotaFiscalService.asmx?WSDL
~~~

curl-7_80_0 without the revert:
~~~
    TLSv1.2 Record Layer: Handshake Protocol: Certificate
        Content Type: Handshake (22)
        Version: TLS 1.2 (0x0303)
        Length: 2840
        Handshake Protocol: Certificate
            Handshake Type: Certificate (11)
            Length: 2812
            Certificates Length: 2809
            Certificates (2809 bytes)
                Certificate Length: 1394
                Certificate: 3082056e30820356a003020102020101300d06092a864886f70d01010b05003046310b30… (id-at-commonName=*.s3-us-west-2.amazonaws.com)
                Certificate Length: 1409
                Certificate: 3082057d30820365a00302010202144919c702951ff3e181ca6d294f6256b492bc72fc30… (id-at-commonName=Amazon,id-at-organizationalUnitName=Server CA 1B,id-at-organizationName=Amazon,id-at-countryName=US)
~~~

curl-7_80_0 with the revert:
~~~
    TLSv1.2 Record Layer: Handshake Protocol: Certificate
        Content Type: Handshake (22)
        Version: TLS 1.2 (0x0303)
        Length: 2840
        Handshake Protocol: Certificate
            Handshake Type: Certificate (11)
            Length: 2812
            Certificates Length: 2809
            Certificates (2809 bytes)
                Certificate Length: 1394
                Certificate: 3082056e30820356a003020102020101300d06092a864886f70d01010b05003046310b30… (id-at-commonName=*.s3-us-west-2.amazonaws.com)
                Certificate Length: 1409
                Certificate: 3082057d30820365a00302010202144919c702951ff3e181ca6d294f6256b492bc72fc30… (id-at-commonName=Amazon,id-at-organizationalUnitName=Server CA 1B,id-at-organizationName=Amazon,id-at-countryName=US)
~~~

**Comment by jay** [comment]
> even when placing the certificates in the requested order in the client file, as I mentioned before, it did not work in the client production environment (in fact, it stopped working in versions lower than 7.80.0 as well).

Ok, that's unusual. I would think there is some difference in success and fail cases in the way the TLS handshake or HTTP request is sent that causes the issue you reported, especially in the 'Certificate' field. Regardless, we aren't going back to loading CA certificates on --insecure.

I can try building curl exactly as you build it, with the same dependencies, if you can share your exact build environment and steps for curl and OpenSSL. Then I can compare the handshakes and requests with different versions of curl built the way you build it. Aside from that though, to investigate further we would need a way to reproduce what you are reporting. If the handshakes are basically identical, and the requests are identical, I don't know what else we can do.

**Comment by jay** [comment]
Closing due to no response and no evidence this is a libcurl issue.
